DATE,PRECIP,EVAP,TMAX,TMIN,FECHA_AUX,FECHA_AUX2,Year,Month
01/01/1961,0.0,2.9,23.0,9.0,01/01/1961,1961-01-01,1961,1
02/01/1961,0.0,4.5,27.0,10.5,02/01/1961,1961-01-02,1961,1
03/01/1961,0.0,7.0,27.5,11.0,03/01/1961,1961-01-03,1961,1
04/01/1961,0.0,3.4,25.5,15.5,04/01/1961,1961-01-04,1961,1
05/01/1961,0.5,2.0,21.0,15.5,05/01/1961,1961-01-05,1961,1
06/01/1961,0.0,3.9,25.5,15.5,06/01/1961,1961-01-06,1961,1
07/01/1961,0.0,10.5,27.5,12.5,07/01/1961,1961-01-07,1961,1
08/01/1961,0.0,11.6,25.5,14.5,08/01/1961,1961-01-08,1961,1
09/01/1961,0.0,8.6,27.0,18.5,09/01/1961,1961-01-09,1961,1
10/01/1961,0.0,4.8,32.0,15.5,10/01/1961,1961-01-10,1961,1
11/01/1961,0.0,10.4,30.0,11.5,11/01/1961,1961-01-11,1961,1
12/01/1961,0.0,6.2,30.5,15.0,12/01/1961,1961-01-12,1961,1
13/01/1961,0.0,6.6,32.0,11.0,13/01/1961,1961-01-13,1961,1
14/01/1961,0.0,3.8,30.5,11.0,14/01/1961,1961-01-14,1961,1
15/01/1961,0.0,7.2,31.5,10.5,15/01/1961,1961-01-15,1961,1
16/01/1961,0.0,7.6,33.5,13.5,16/01/1961,1961-01-16,1961,1
17/01/1961,8.0,2.1,28.5,13.0,17/01/1961,1961-01-17,1961,1
18/01/1961,16.5,1.2,24.0,15.0,18/01/1961,1961-01-18,1961,1
19/01/1961,20.0,0.6,22.5,16.0,19/01/1961,1961-01-19,1961,1
20/01/1961,1.0,0.9,23.0,13.5,20/01/1961,1961-01-20,1961,1
21/01/1961,0.0,2.8,25.5,14.0,21/01/1961,1961-01-21,1961,1
22/01/1961,57.8,3.8,23.0,15.0,22/01/1961,1961-01-22,1961,1
23/01/1961,40.2,0.4,23.5,15.5,23/01/1961,1961-01-23,1961,1
24/01/1961,0.0,2.0,26.0,13.5,24/01/1961,1961-01-24,1961,1
25/01/1961,0.0,5.2,26.5,11.5,25/01/1961,1961-01-25,1961,1
26/01/1961,0.0,2.9,26.0,11.0,26/01/1961,1961-01-26,1961,1
27/01/1961,0.0,3.5,28.0,10.5,27/01/1961,1961-01-27,1961,1
28/01/1961,0.0,3.8,27.5,9.5,28/01/1961,1961-01-28,1961,1
29/01/1961,0.0,2.8,29.5,12.0,29/01/1961,1961-01-29,1961,1
30/01/1961,0.0,4.9,30.0,12.5,30/01/1961,1961-01-30,1961,1
31/01/1961,0.0,4.5,31.0,13.5,31/01/1961,1961-01-31,1961,1
01/02/1961,0.0,5.3,29.0,11.0,01/02/1961,1961-02-01,1961,2
02/02/1961,0.0,7.2,32.0,12.0,02/02/1961,1961-02-02,1961,2
03/02/1961,0.0,3.7,30.0,11.5,03/02/1961,1961-02-03,1961,2
04/02/1961,0.0,4.1,29.0,9.5,04/02/1961,1961-02-04,1961,2
05/02/1961,0.0,3.1,24.5,7.5,05/02/1961,1961-02-05,1961,2
06/02/1961,0.0,3.4,25.0,5.5,06/02/1961,1961-02-06,1961,2
07/02/1961,0.0,5.8,27.5,7.0,07/02/1961,1961-02-07,1961,2
08/02/1961,0.0,4.5,30.0,7.0,08/02/1961,1961-02-08,1961,2
09/02/1961,0.0,6.7,31.5,8.0,09/02/1961,1961-02-09,1961,2
10/02/1961,0.0,11.5,32.0,10.0,10/02/1961,1961-02-10,1961,2
11/02/1961,0.0,7.9,33.0,11.0,11/02/1961,1961-02-11,1961,2
12/02/1961,0.0,9.6,35.5,14.0,12/02/1961,1961-02-12,1961,2
13/02/1961,0.0,5.6,34.0,11.5,13/02/1961,1961-02-13,1961,2
14/02/1961,0.0,6.2,33.0,12.5,14/02/1961,1961-02-14,1961,2
15/02/1961,0.0,5.7,33.5,12.0,15/02/1961,1961-02-15,1961,2
16/02/1961,0.0,4.0,33.5,11.0,16/02/1961,1961-02-16,1961,2
17/02/1961,0.0,5.7,30.5,8.5,17/02/1961,1961-02-17,1961,2
18/02/1961,0.0,4.9,31.5,9.5,18/02/1961,1961-02-18,1961,2
19/02/1961,0.0,4.6,22.5,12.0,19/02/1961,1961-02-19,1961,2
20/02/1961,0.0,4.7,30.0,6.0,20/02/1961,1961-02-20,1961,2
21/02/1961,0.0,6.8,32.0,7.5,21/02/1961,1961-02-21,1961,2
22/02/1961,0.0,4.2,33.5,8.0,22/02/1961,1961-02-22,1961,2
23/02/1961,0.0,4.2,31.5,10.0,23/02/1961,1961-02-23,1961,2
24/02/1961,0.0,8.8,35.0,7.5,24/02/1961,1961-02-24,1961,2
25/02/1961,0.0,8.8,38.5,12.5,25/02/1961,1961-02-25,1961,2
26/02/1961,0.0,7.9,36.0,8.0,26/02/1961,1961-02-26,1961,2
27/02/1961,0.0,5.8,33.0,8.0,27/02/1961,1961-02-27,1961,2
28/02/1961,0.0,6.9,32.0,10.0,28/02/1961,1961-02-28,1961,2
01/03/1961,0.0,6.8,38.5,11.5,01/03/1961,1961-03-01,1961,3
02/03/1961,0.0,5.9,32.0,9.0,02/03/1961,1961-03-02,1961,3
03/03/1961,0.0,6.7,33.5,9.0,03/03/1961,1961-03-03,1961,3
04/03/1961,0.0,6.0,34.5,9.0,04/03/1961,1961-03-04,1961,3
05/03/1961,0.0,5.9,35.5,11.5,05/03/1961,1961-03-05,1961,3
06/03/1961,0.0,6.6,39.0,11.0,06/03/1961,1961-03-06,1961,3
07/03/1961,0.0,7.6,40.5,11.0,07/03/1961,1961-03-07,1961,3
08/03/1961,0.0,11.2,43.5,12.5,08/03/1961,1961-03-08,1961,3
09/03/1961,0.0,11.4,40.0,19.5,09/03/1961,1961-03-09,1961,3
10/03/1961,0.0,2.7,36.0,13.5,10/03/1961,1961-03-10,1961,3
11/03/1961,0.0,6.1,41.0,10.0,11/03/1961,1961-03-11,1961,3
12/03/1961,0.0,7.6,42.5,10.0,12/03/1961,1961-03-12,1961,3
13/03/1961,0.0,6.6,34.0,9.0,13/03/1961,1961-03-13,1961,3
14/03/1961,0.0,6.2,39.0,11.5,14/03/1961,1961-03-14,1961,3
15/03/1961,0.0,8.3,38.5,13.5,15/03/1961,1961-03-15,1961,3
16/03/1961,0.0,6.1,32.5,11.0,16/03/1961,1961-03-16,1961,3
17/03/1961,0.0,4.4,37.0,7.5,17/03/1961,1961-03-17,1961,3
18/03/1961,0.0,3.0,35.0,8.0,18/03/1961,1961-03-18,1961,3
19/03/1961,0.0,4.6,41.0,9.0,19/03/1961,1961-03-19,1961,3
20/03/1961,0.0,6.3,37.0,10.0,20/03/1961,1961-03-20,1961,3
21/03/1961,0.0,7.2,37.5,10.0,21/03/1961,1961-03-21,1961,3
22/03/1961,0.0,8.2,37.0,11.5,22/03/1961,1961-03-22,1961,3
23/03/1961,0.0,7.9,38.5,12.0,23/03/1961,1961-03-23,1961,3
24/03/1961,0.0,8.1,37.0,10.0,24/03/1961,1961-03-24,1961,3
25/03/1961,0.0,6.3,37.5,12.0,25/03/1961,1961-03-25,1961,3
26/03/1961,0.0,5.6,41.5,14.5,26/03/1961,1961-03-26,1961,3
27/03/1961,0.0,7.1,43.5,12.5,27/03/1961,1961-03-27,1961,3
28/03/1961,0.0,7.7,40.5,11.0,28/03/1961,1961-03-28,1961,3
29/03/1961,0.0,6.3,33.0,10.5,29/03/1961,1961-03-29,1961,3
30/03/1961,0.0,8.1,37.5,12.0,30/03/1961,1961-03-30,1961,3
31/03/1961,0.0,7.9,40.0,9.5,31/03/1961,1961-03-31,1961,3
01/04/1961,0.0,8.0,40.5,10.0,01/04/1961,1961-04-01,1961,4
02/04/1961,0.0,7.2,37.0,11.0,02/04/1961,1961-04-02,1961,4
03/04/1961,0.0,8.6,38.5,11.5,03/04/1961,1961-04-03,1961,4
04/04/1961,0.0,3.4,31.5,12.5,04/04/1961,1961-04-04,1961,4
05/04/1961,0.0,5.9,31.5,14.0,05/04/1961,1961-04-05,1961,4
06/04/1961,0.0,7.5,42.0,13.5,06/04/1961,1961-04-06,1961,4
07/04/1961,0.0,8.7,39.5,14.0,07/04/1961,1961-04-07,1961,4
08/04/1961,0.0,8.0,33.5,12.5,08/04/1961,1961-04-08,1961,4
09/04/1961,0.0,8.9,35.0,14.5,09/04/1961,1961-04-09,1961,4
10/04/1961,0.0,10.9,32.0,14.5,10/04/1961,1961-04-10,1961,4
11/04/1961,0.0,8.6,33.0,10.5,11/04/1961,1961-04-11,1961,4
12/04/1961,0.0,10.1,42.0,12.5,12/04/1961,1961-04-12,1961,4
13/04/1961,0.0,9.3,35.5,12.0,13/04/1961,1961-04-13,1961,4
14/04/1961,0.0,7.9,36.5,12.5,14/04/1961,1961-04-14,1961,4
15/04/1961,0.0,11.4,40.5,15.5,15/04/1961,1961-04-15,1961,4
16/04/1961,0.0,9.6,40.0,17.0,16/04/1961,1961-04-16,1961,4
17/04/1961,0.0,9.6,38.0,19.0,17/04/1961,1961-04-17,1961,4
18/04/1961,0.0,8.9,41.0,18.5,18/04/1961,1961-04-18,1961,4
19/04/1961,0.0,10.2,41.0,16.0,19/04/1961,1961-04-19,1961,4
20/04/1961,0.0,7.6,44.0,16.0,20/04/1961,1961-04-20,1961,4
21/04/1961,0.0,5.9,43.0,9.0,21/04/1961,1961-04-21,1961,4
22/04/1961,0.0,5.5,44.5,11.0,22/04/1961,1961-04-22,1961,4
23/04/1961,0.0,9.8,44.0,21.0,23/04/1961,1961-04-23,1961,4
24/04/1961,0.0,12.2,38.0,8.0,24/04/1961,1961-04-24,1961,4
25/04/1961,0.0,9.1,37.5,16.5,25/04/1961,1961-04-25,1961,4
26/04/1961,0.0,10.6,39.0,10.5,26/04/1961,1961-04-26,1961,4
27/04/1961,0.0,9.4,38.5,13.5,27/04/1961,1961-04-27,1961,4
28/04/1961,0.0,9.2,39.5,14.5,28/04/1961,1961-04-28,1961,4
29/04/1961,0.0,10.9,41.0,15.5,29/04/1961,1961-04-29,1961,4
30/04/1961,0.0,12.7,40.0,17.0,30/04/1961,1961-04-30,1961,4
01/05/1961,0.0,8.1,46.5,16.0,01/05/1961,1961-05-01,1961,5
02/05/1961,0.0,15.3,43.0,15.5,02/05/1961,1961-05-02,1961,5
03/05/1961,0.0,10.7,45.5,16.5,03/05/1961,1961-05-03,1961,5
04/05/1961,0.0,10.7,35.5,14.5,04/05/1961,1961-05-04,1961,5
05/05/1961,0.0,8.6,36.5,14.5,05/05/1961,1961-05-05,1961,5
06/05/1961,0.0,9.8,38.0,15.5,06/05/1961,1961-05-06,1961,5
07/05/1961,0.0,10.1,38.0,15.0,07/05/1961,1961-05-07,1961,5
08/05/1961,0.0,13.1,40.5,14.0,08/05/1961,1961-05-08,1961,5
09/05/1961,0.0,12.6,39.0,14.5,09/05/1961,1961-05-09,1961,5
10/05/1961,0.0,10.3,43.5,19.0,10/05/1961,1961-05-10,1961,5
11/05/1961,0.0,10.5,39.0,19.5,11/05/1961,1961-05-11,1961,5
12/05/1961,0.0,8.2,39.0,17.0,12/05/1961,1961-05-12,1961,5
13/05/1961,0.0,10.3,38.5,15.0,13/05/1961,1961-05-13,1961,5
14/05/1961,0.0,8.6,39.0,14.5,14/05/1961,1961-05-14,1961,5
15/05/1961,0.0,11.3,40.0,15.0,15/05/1961,1961-05-15,1961,5
16/05/1961,0.0,11.2,40.0,14.0,16/05/1961,1961-05-16,1961,5
17/05/1961,0.0,12.2,37.5,18.0,17/05/1961,1961-05-17,1961,5
18/05/1961,0.0,12.5,41.0,19.0,18/05/1961,1961-05-18,1961,5
19/05/1961,0.0,10.0,46.0,19.0,19/05/1961,1961-05-19,1961,5
20/05/1961,0.0,9.8,44.5,20.0,20/05/1961,1961-05-20,1961,5
21/05/1961,0.0,12.6,40.0,17.0,21/05/1961,1961-05-21,1961,5
22/05/1961,0.0,10.1,46.0,14.0,22/05/1961,1961-05-22,1961,5
23/05/1961,0.0,8.7,45.0,16.5,23/05/1961,1961-05-23,1961,5
24/05/1961,0.0,10.2,38.0,17.0,24/05/1961,1961-05-24,1961,5
25/05/1961,0.0,13.1,41.0,18.5,25/05/1961,1961-05-25,1961,5
26/05/1961,0.0,12.6,44.5,21.0,26/05/1961,1961-05-26,1961,5
27/05/1961,0.0,12.6,44.0,21.0,27/05/1961,1961-05-27,1961,5
28/05/1961,0.0,9.7,40.5,21.5,28/05/1961,1961-05-28,1961,5
29/05/1961,0.0,10.1,40.5,20.0,29/05/1961,1961-05-29,1961,5
30/05/1961,0.0,10.5,51.0,21.0,30/05/1961,1961-05-30,1961,5
31/05/1961,0.0,8.6,41.0,21.5,31/05/1961,1961-05-31,1961,5
01/06/1961,0.0,12.9,40.5,21.5,01/06/1961,1961-06-01,1961,6
02/06/1961,0.0,7.4,40.5,23.0,02/06/1961,1961-06-02,1961,6
03/06/1961,0.0,6.9,45.5,19.5,03/06/1961,1961-06-03,1961,6
04/06/1961,0.0,14.0,42.5,18.5,04/06/1961,1961-06-04,1961,6
05/06/1961,0.0,12.0,44.5,18.5,05/06/1961,1961-06-05,1961,6
06/06/1961,0.0,12.9,41.0,18.0,06/06/1961,1961-06-06,1961,6
07/06/1961,0.0,12.8,41.0,21.0,07/06/1961,1961-06-07,1961,6
08/06/1961,0.0,11.2,43.0,19.0,08/06/1961,1961-06-08,1961,6
09/06/1961,0.0,12.0,39.0,20.0,09/06/1961,1961-06-09,1961,6
10/06/1961,0.0,13.0,39.5,20.0,10/06/1961,1961-06-10,1961,6
11/06/1961,0.0,12.6,36.5,20.5,11/06/1961,1961-06-11,1961,6
12/06/1961,0.0,11.3,35.0,22.5,12/06/1961,1961-06-12,1961,6
13/06/1961,0.0,10.6,36.0,25.0,13/06/1961,1961-06-13,1961,6
14/06/1961,11.0,12.2,36.5,24.5,14/06/1961,1961-06-14,1961,6
15/06/1961,0.0,9.1,36.0,20.5,15/06/1961,1961-06-15,1961,6
16/06/1961,46.0,14.6,35.5,20.0,16/06/1961,1961-06-16,1961,6
17/06/1961,83.0,13.1,35.0,23.0,17/06/1961,1961-06-17,1961,6
18/06/1961,0.0,11.7,36.0,22.0,18/06/1961,1961-06-18,1961,6
19/06/1961,0.0,8.6,37.5,21.5,19/06/1961,1961-06-19,1961,6
20/06/1961,20.9,9.3,35.0,20.5,20/06/1961,1961-06-20,1961,6
21/06/1961,0.0,7.3,41.0,19.5,21/06/1961,1961-06-21,1961,6
22/06/1961,0.0,8.6,40.5,23.0,22/06/1961,1961-06-22,1961,6
23/06/1961,0.0,9.2,43.0,24.0,23/06/1961,1961-06-23,1961,6
24/06/1961,0.0,12.2,35.5,26.0,24/06/1961,1961-06-24,1961,6
25/06/1961,0.0,8.0,40.0,25.5,25/06/1961,1961-06-25,1961,6
26/06/1961,7.5,17.4,34.0,25.0,26/06/1961,1961-06-26,1961,6
27/06/1961,0.0,11.1,34.5,21.0,27/06/1961,1961-06-27,1961,6
28/06/1961,0.0,6.3,38.5,20.0,28/06/1961,1961-06-28,1961,6
29/06/1961,0.0,6.7,39.0,22.5,29/06/1961,1961-06-29,1961,6
30/06/1961,0.0,2.1,34.5,23.5,30/06/1961,1961-06-30,1961,6
01/07/1961,11.0,8.9,35.0,23.5,01/07/1961,1961-07-01,1961,7
02/07/1961,1.2,5.7,35.5,22.5,02/07/1961,1961-07-02,1961,7
03/07/1961,0.0,7.1,36.0,21.0,03/07/1961,1961-07-03,1961,7
04/07/1961,20.0,8.5,41.0,22.0,04/07/1961,1961-07-04,1961,7
05/07/1961,20.9,9.3,40.0,22.5,05/07/1961,1961-07-05,1961,7
06/07/1961,6.8,9.0,34.0,22.5,06/07/1961,1961-07-06,1961,7
07/07/1961,20.2,7.8,32.5,22.0,07/07/1961,1961-07-07,1961,7
08/07/1961,0.0,3.3,40.0,21.5,08/07/1961,1961-07-08,1961,7
09/07/1961,0.0,7.9,41.0,22.0,09/07/1961,1961-07-09,1961,7
10/07/1961,0.0,11.1,35.5,24.0,10/07/1961,1961-07-10,1961,7
11/07/1961,10.0,1.9,34.0,22.0,11/07/1961,1961-07-11,1961,7
12/07/1961,0.0,5.8,39.0,21.0,12/07/1961,1961-07-12,1961,7
13/07/1961,0.0,7.5,33.5,22.0,13/07/1961,1961-07-13,1961,7
14/07/1961,8.4,4.6,38.0,23.0,14/07/1961,1961-07-14,1961,7
15/07/1961,43.0,9.2,38.0,23.0,15/07/1961,1961-07-15,1961,7
16/07/1961,46.9,10.3,32.5,21.5,16/07/1961,1961-07-16,1961,7
17/07/1961,0.0,9.4,39.0,21.5,17/07/1961,1961-07-17,1961,7
18/07/1961,0.0,6.1,39.5,21.0,18/07/1961,1961-07-18,1961,7
19/07/1961,15.8,8.3,38.0,22.0,19/07/1961,1961-07-19,1961,7
20/07/1961,21.4,6.6,35.5,21.0,20/07/1961,1961-07-20,1961,7
21/07/1961,12.9,4.8,35.0,20.5,21/07/1961,1961-07-21,1961,7
22/07/1961,6.0,6.0,29.0,22.0,22/07/1961,1961-07-22,1961,7
23/07/1961,0.0,4.1,34.0,21.0,23/07/1961,1961-07-23,1961,7
24/07/1961,7.8,5.1,30.5,21.5,24/07/1961,1961-07-24,1961,7
25/07/1961,7.6,8.2,35.5,22.5,25/07/1961,1961-07-25,1961,7
26/07/1961,0.0,9.8,30.5,23.5,26/07/1961,1961-07-26,1961,7
27/07/1961,0.0,9.4,40.0,22.0,27/07/1961,1961-07-27,1961,7
28/07/1961,22.2,11.9,36.5,22.5,28/07/1961,1961-07-28,1961,7
29/07/1961,0.0,13.9,28.0,22.0,29/07/1961,1961-07-29,1961,7
30/07/1961,0.0,11.5,36.5,21.5,30/07/1961,1961-07-30,1961,7
31/07/1961,0.0,8.4,39.0,20.5,31/07/1961,1961-07-31,1961,7
01/08/1961,6.0,4.0,40.0,21.0,01/08/1961,1961-08-01,1961,8
02/08/1961,2.3,5.4,36.5,22.0,02/08/1961,1961-08-02,1961,8
03/08/1961,5.3,2.8,35.0,22.0,03/08/1961,1961-08-03,1961,8
04/08/1961,0.0,6.5,39.0,22.0,04/08/1961,1961-08-04,1961,8
05/08/1961,0.0,5.4,39.5,23.0,05/08/1961,1961-08-05,1961,8
06/08/1961,0.0,5.6,40.5,22.5,06/08/1961,1961-08-06,1961,8
07/08/1961,0.0,6.3,42.0,22.5,07/08/1961,1961-08-07,1961,8
08/08/1961,1.2,6.8,40.5,25.0,08/08/1961,1961-08-08,1961,8
09/08/1961,0.6,6.1,39.0,22.5,09/08/1961,1961-08-09,1961,8
10/08/1961,7.9,7.7,39.0,23.5,10/08/1961,1961-08-10,1961,8
11/08/1961,0.0,4.9,37.5,22.5,11/08/1961,1961-08-11,1961,8
12/08/1961,0.0,10.2,38.0,23.0,12/08/1961,1961-08-12,1961,8
13/08/1961,0.0,6.1,37.0,21.5,13/08/1961,1961-08-13,1961,8
14/08/1961,8.4,11.4,37.0,22.5,14/08/1961,1961-08-14,1961,8
15/08/1961,0.0,10.8,41.0,21.5,15/08/1961,1961-08-15,1961,8
16/08/1961,21.9,9.0,35.5,22.0,16/08/1961,1961-08-16,1961,8
17/08/1961,26.5,5.6,37.0,22.0,17/08/1961,1961-08-17,1961,8
18/08/1961,0.0,5.4,32.0,22.0,18/08/1961,1961-08-18,1961,8
19/08/1961,1.0,7.9,40.0,23.0,19/08/1961,1961-08-19,1961,8
20/08/1961,0.0,6.6,43.5,22.5,20/08/1961,1961-08-20,1961,8
21/08/1961,0.0,6.7,40.5,23.0,21/08/1961,1961-08-21,1961,8
22/08/1961,0.0,6.9,44.5,23.0,22/08/1961,1961-08-22,1961,8
23/08/1961,0.0,8.1,42.5,24.0,23/08/1961,1961-08-23,1961,8
24/08/1961,0.0,8.8,41.5,24.0,24/08/1961,1961-08-24,1961,8
25/08/1961,0.0,7.0,41.0,25.0,25/08/1961,1961-08-25,1961,8
26/08/1961,3.8,11.1,43.5,22.0,26/08/1961,1961-08-26,1961,8
27/08/1961,0.0,8.9,34.0,24.0,27/08/1961,1961-08-27,1961,8
28/08/1961,43.7,6.4,37.0,24.0,28/08/1961,1961-08-28,1961,8
29/08/1961,0.0,4.6,39.0,21.0,29/08/1961,1961-08-29,1961,8
30/08/1961,2.7,5.7,39.0,22.0,30/08/1961,1961-08-30,1961,8
31/08/1961,0.0,4.8,38.0,22.0,31/08/1961,1961-08-31,1961,8
01/09/1961,0.0,5.8,39.5,22.5,01/09/1961,1961-09-01,1961,9
02/09/1961,0.0,4.6,39.0,22.0,02/09/1961,1961-09-02,1961,9
03/09/1961,0.0,7.9,40.5,23.0,03/09/1961,1961-09-03,1961,9
04/09/1961,36.5,5.0,39.0,22.5,04/09/1961,1961-09-04,1961,9
05/09/1961,0.0,5.0,42.5,22.0,05/09/1961,1961-09-05,1961,9
06/09/1961,11.7,6.6,41.5,23.0,06/09/1961,1961-09-06,1961,9
07/09/1961,0.0,5.7,32.0,21.0,07/09/1961,1961-09-07,1961,9
08/09/1961,1.2,4.7,32.0,24.0,08/09/1961,1961-09-08,1961,9
09/09/1961,1.8,5.5,42.5,21.5,09/09/1961,1961-09-09,1961,9
10/09/1961,4.8,5.1,38.5,22.0,10/09/1961,1961-09-10,1961,9
11/09/1961,0.0,6.0,38.0,23.0,11/09/1961,1961-09-11,1961,9
12/09/1961,0.0,4.1,39.0,23.5,12/09/1961,1961-09-12,1961,9
13/09/1961,0.0,5.7,37.0,21.5,13/09/1961,1961-09-13,1961,9
14/09/1961,15.5,6.0,38.5,22.0,14/09/1961,1961-09-14,1961,9
15/09/1961,15.4,4.0,30.5,22.0,15/09/1961,1961-09-15,1961,9
16/09/1961,20.0,2.3,37.0,23.0,16/09/1961,1961-09-16,1961,9
17/09/1961,0.0,3.1,38.0,21.0,17/09/1961,1961-09-17,1961,9
18/09/1961,0.0,5.7,38.5,22.5,18/09/1961,1961-09-18,1961,9
19/09/1961,0.0,4.5,39.0,22.0,19/09/1961,1961-09-19,1961,9
20/09/1961,0.0,5.2,39.0,22.0,20/09/1961,1961-09-20,1961,9
21/09/1961,0.0,7.1,38.5,20.0,21/09/1961,1961-09-21,1961,9
22/09/1961,0.0,5.1,40.0,21.5,22/09/1961,1961-09-22,1961,9
23/09/1961,0.0,7.8,37.5,20.0,23/09/1961,1961-09-23,1961,9
24/09/1961,0.0,4.9,39.5,21.0,24/09/1961,1961-09-24,1961,9
25/09/1961,0.0,7.2,42.5,20.5,25/09/1961,1961-09-25,1961,9
26/09/1961,8.5,7.1,40.0,21.5,26/09/1961,1961-09-26,1961,9
27/09/1961,1.4,5.2,40.0,22.0,27/09/1961,1961-09-27,1961,9
28/09/1961,3.5,7.5,34.5,23.5,28/09/1961,1961-09-28,1961,9
29/09/1961,0.0,5.9,38.0,22.5,29/09/1961,1961-09-29,1961,9
30/09/1961,0.0,5.3,42.0,23.5,30/09/1961,1961-09-30,1961,9
01/10/1961,0.0,7.1,38.5,22.0,01/10/1961,1961-10-01,1961,10
02/10/1961,0.0,5.8,35.0,21.5,02/10/1961,1961-10-02,1961,10
03/10/1961,0.0,9.9,35.0,19.5,03/10/1961,1961-10-03,1961,10
04/10/1961,0.0,5.8,40.0,20.0,04/10/1961,1961-10-04,1961,10
05/10/1961,33.0,7.4,41.5,21.0,05/10/1961,1961-10-05,1961,10
06/10/1961,0.0,5.4,40.0,20.0,06/10/1961,1961-10-06,1961,10
07/10/1961,0.0,8.9,31.5,21.0,07/10/1961,1961-10-07,1961,10
08/10/1961,55.3,9.0,35.0,22.0,08/10/1961,1961-10-08,1961,10
09/10/1961,0.0,1.8,30.0,20.0,09/10/1961,1961-10-09,1961,10
10/10/1961,0.0,4.0,38.5,19.5,10/10/1961,1961-10-10,1961,10
11/10/1961,0.0,3.7,40.0,16.5,11/10/1961,1961-10-11,1961,10
12/10/1961,0.0,4.6,40.5,17.5,12/10/1961,1961-10-12,1961,10
13/10/1961,0.0,6.5,41.5,18.5,13/10/1961,1961-10-13,1961,10
14/10/1961,0.0,4.4,36.5,20.5,14/10/1961,1961-10-14,1961,10
15/10/1961,0.0,4.8,34.5,21.0,15/10/1961,1961-10-15,1961,10
16/10/1961,0.0,7.6,38.0,20.0,16/10/1961,1961-10-16,1961,10
17/10/1961,0.0,6.0,39.0,18.0,17/10/1961,1961-10-17,1961,10
18/10/1961,0.0,6.5,39.0,17.5,18/10/1961,1961-10-18,1961,10
19/10/1961,0.0,5.7,40.0,19.0,19/10/1961,1961-10-19,1961,10
20/10/1961,0.0,4.6,39.5,19.0,20/10/1961,1961-10-20,1961,10
21/10/1961,0.0,6.1,38.5,19.0,21/10/1961,1961-10-21,1961,10
22/10/1961,0.0,4.8,39.0,19.0,22/10/1961,1961-10-22,1961,10
23/10/1961,0.0,5.8,38.0,16.0,23/10/1961,1961-10-23,1961,10
24/10/1961,0.0,5.8,37.0,15.5,24/10/1961,1961-10-24,1961,10
25/10/1961,0.0,6.1,38.0,15.5,25/10/1961,1961-10-25,1961,10
26/10/1961,0.0,7.1,39.5,16.5,26/10/1961,1961-10-26,1961,10
27/10/1961,0.0,7.0,37.0,15.0,27/10/1961,1961-10-27,1961,10
28/10/1961,0.0,3.6,34.0,16.5,28/10/1961,1961-10-28,1961,10
29/10/1961,1.6,8.7,32.0,20.5,29/10/1961,1961-10-29,1961,10
30/10/1961,9.5,7.3,25.0,19.0,30/10/1961,1961-10-30,1961,10
31/10/1961,12.7,5.9,31.5,20.0,31/10/1961,1961-10-31,1961,10
01/11/1961,0.0,8.3,26.0,18.5,01/11/1961,1961-11-01,1961,11
02/11/1961,0.0,4.1,28.0,9.5,02/11/1961,1961-11-02,1961,11
03/11/1961,0.0,3.7,33.0,10.5,03/11/1961,1961-11-03,1961,11
04/11/1961,0.0,3.5,34.5,12.0,04/11/1961,1961-11-04,1961,11
05/11/1961,0.0,4.8,33.0,14.0,05/11/1961,1961-11-05,1961,11
06/11/1961,1.2,2.0,34.5,14.5,06/11/1961,1961-11-06,1961,11
07/11/1961,11.4,1.3,21.5,10.0,07/11/1961,1961-11-07,1961,11
08/11/1961,0.0,0.7,24.5,12.5,08/11/1961,1961-11-08,1961,11
09/11/1961,0.0,2.8,30.0,17.5,09/11/1961,1961-11-09,1961,11
10/11/1961,0.0,2.7,31.0,13.5,10/11/1961,1961-11-10,1961,11
11/11/1961,0.0,3.6,33.0,15.5,11/11/1961,1961-11-11,1961,11
12/11/1961,0.0,3.6,32.0,15.0,12/11/1961,1961-11-12,1961,11
13/11/1961,0.0,3.8,30.0,14.5,13/11/1961,1961-11-13,1961,11
14/11/1961,0.0,2.1,30.5,12.0,14/11/1961,1961-11-14,1961,11
15/11/1961,0.0,3.0,39.0,11.5,15/11/1961,1961-11-15,1961,11
16/11/1961,0.0,1.6,32.0,6.5,16/11/1961,1961-11-16,1961,11
17/11/1961,0.0,3.2,33.0,12.0,17/11/1961,1961-11-17,1961,11
18/11/1961,0.0,3.7,33.0,11.0,18/11/1961,1961-11-18,1961,11
19/11/1961,0.0,2.8,31.0,14.5,19/11/1961,1961-11-19,1961,11
20/11/1961,0.0,2.8,31.0,12.0,20/11/1961,1961-11-20,1961,11
21/11/1961,0.0,1.3,23.5,13.0,21/11/1961,1961-11-21,1961,11
22/11/1961,0.0,2.8,29.0,10.5,22/11/1961,1961-11-22,1961,11
23/11/1961,0.0,5.1,31.0,8.0,23/11/1961,1961-11-23,1961,11
24/11/1961,0.0,5.1,32.0,11.5,24/11/1961,1961-11-24,1961,11
25/11/1961,0.0,6.3,35.0,13.0,25/11/1961,1961-11-25,1961,11
26/11/1961,0.0,5.0,35.0,12.0,26/11/1961,1961-11-26,1961,11
27/11/1961,0.0,5.2,38.0,14.0,27/11/1961,1961-11-27,1961,11
28/11/1961,0.0,3.5,34.0,12.5,28/11/1961,1961-11-28,1961,11
29/11/1961,0.0,3.1,34.0,11.5,29/11/1961,1961-11-29,1961,11
30/11/1961,0.0,5.9,29.0,11.5,30/11/1961,1961-11-30,1961,11
01/12/1961,0.0,5.9,33.5,15.0,01/12/1961,1961-12-01,1961,12
02/12/1961,0.0,5.4,33.5,10.5,02/12/1961,1961-12-02,1961,12
03/12/1961,0.0,3.0,31.0,10.5,03/12/1961,1961-12-03,1961,12
04/12/1961,0.0,3.4,30.0,10.0,04/12/1961,1961-12-04,1961,12
05/12/1961,0.0,3.6,30.5,9.5,05/12/1961,1961-12-05,1961,12
06/12/1961,0.0,2.6,27.5,9.0,06/12/1961,1961-12-06,1961,12
07/12/1961,2.5,2.3,29.0,10.5,07/12/1961,1961-12-07,1961,12
08/12/1961,2.5,0.5,18.0,14.5,08/12/1961,1961-12-08,1961,12
09/12/1961,0.0,1.3,21.5,13.5,09/12/1961,1961-12-09,1961,12
10/12/1961,1.0,1.5,24.0,15.0,10/12/1961,1961-12-10,1961,12
11/12/1961,0.0,2.7,27.0,15.5,11/12/1961,1961-12-11,1961,12
12/12/1961,0.0,2.3,28.0,11.0,12/12/1961,1961-12-12,1961,12
13/12/1961,0.0,2.3,25.0,11.0,13/12/1961,1961-12-13,1961,12
14/12/1961,0.0,1.6,27.5,13.0,14/12/1961,1961-12-14,1961,12
15/12/1961,0.0,2.3,28.0,14.5,15/12/1961,1961-12-15,1961,12
16/12/1961,0.0,3.5,26.0,14.0,16/12/1961,1961-12-16,1961,12
17/12/1961,0.0,1.8,25.0,7.0,17/12/1961,1961-12-17,1961,12
18/12/1961,0.0,3.1,28.0,6.0,18/12/1961,1961-12-18,1961,12
19/12/1961,0.0,5.4,29.0,9.5,19/12/1961,1961-12-19,1961,12
20/12/1961,0.0,3.5,30.5,9.5,20/12/1961,1961-12-20,1961,12
21/12/1961,0.0,3.9,30.5,10.0,21/12/1961,1961-12-21,1961,12
22/12/1961,0.0,6.0,29.0,11.5,22/12/1961,1961-12-22,1961,12
23/12/1961,0.0,5.4,32.0,10.5,23/12/1961,1961-12-23,1961,12
24/12/1961,0.0,4.5,33.0,12.0,24/12/1961,1961-12-24,1961,12
25/12/1961,0.0,3.7,31.0,11.5,25/12/1961,1961-12-25,1961,12
26/12/1961,0.0,3.8,31.0,11.0,26/12/1961,1961-12-26,1961,12
27/12/1961,0.0,4.5,30.5,11.5,27/12/1961,1961-12-27,1961,12
28/12/1961,0.0,7.5,31.5,10.0,28/12/1961,1961-12-28,1961,12
29/12/1961,0.0,5.8,29.0,10.5,29/12/1961,1961-12-29,1961,12
30/12/1961,0.0,3.3,30.5,10.0,30/12/1961,1961-12-30,1961,12
31/12/1961,0.0,2.4,31.5,10.0,31/12/1961,1961-12-31,1961,12
01/01/1962,0.0,3.2,30.0,10.5,01/01/1962,1962-01-01,1962,1
02/01/1962,0.0,4.0,30.5,9.0,02/01/1962,1962-01-02,1962,1
03/01/1962,0.0,1.4,29.0,6.0,03/01/1962,1962-01-03,1962,1
04/01/1962,0.0,2.1,29.0,7.0,04/01/1962,1962-01-04,1962,1
05/01/1962,0.0,2.7,28.5,7.0,05/01/1962,1962-01-05,1962,1
06/01/1962,0.0,2.2,29.5,8.5,06/01/1962,1962-01-06,1962,1
07/01/1962,0.0,2.0,32.0,7.0,07/01/1962,1962-01-07,1962,1
08/01/1962,0.0,2.9,31.0,8.0,08/01/1962,1962-01-08,1962,1
09/01/1962,0.0,3.0,31.5,8.5,09/01/1962,1962-01-09,1962,1
10/01/1962,0.0,3.1,30.0,8.0,10/01/1962,1962-01-10,1962,1
11/01/1962,0.0,7.9,34.0,4.0,11/01/1962,1962-01-11,1962,1
12/01/1962,0.0,2.2,29.0,6.0,12/01/1962,1962-01-12,1962,1
13/01/1962,0.0,2.0,26.5,4.5,13/01/1962,1962-01-13,1962,1
14/01/1962,0.0,3.1,28.0,4.0,14/01/1962,1962-01-14,1962,1
15/01/1962,0.0,1.8,31.0,7.0,15/01/1962,1962-01-15,1962,1
16/01/1962,0.0,2.9,34.0,6.5,16/01/1962,1962-01-16,1962,1
17/01/1962,0.0,1.9,29.0,11.0,17/01/1962,1962-01-17,1962,1
18/01/1962,0.0,3.2,32.0,4.0,18/01/1962,1962-01-18,1962,1
19/01/1962,0.0,6.4,32.5,9.0,19/01/1962,1962-01-19,1962,1
20/01/1962,0.0,5.1,33.0,8.5,20/01/1962,1962-01-20,1962,1
21/01/1962,0.0,3.1,26.0,10.0,21/01/1962,1962-01-21,1962,1
22/01/1962,0.0,1.5,23.0,11.5,22/01/1962,1962-01-22,1962,1
23/01/1962,0.0,4.6,32.5,15.0,23/01/1962,1962-01-23,1962,1
24/01/1962,38.0,2.0,32.5,15.0,24/01/1962,1962-01-24,1962,1
25/01/1962,0.0,2.9,19.0,11.5,25/01/1962,1962-01-25,1962,1
26/01/1962,0.0,2.8,25.5,9.5,26/01/1962,1962-01-26,1962,1
27/01/1962,0.0,7.9,29.5,11.0,27/01/1962,1962-01-27,1962,1
28/01/1962,0.0,4.1,30.0,10.5,28/01/1962,1962-01-28,1962,1
29/01/1962,0.6,14.8,27.0,16.5,29/01/1962,1962-01-29,1962,1
30/01/1962,3.4,2.3,22.5,14.5,30/01/1962,1962-01-30,1962,1
31/01/1962,0.0,4.1,29.0,14.5,31/01/1962,1962-01-31,1962,1
01/02/1962,0.0,4.8,29.0,10.0,01/02/1962,1962-02-01,1962,2
02/02/1962,0.0,2.4,32.0,12.5,02/02/1962,1962-02-02,1962,2
03/02/1962,0.0,4.4,30.5,14.0,03/02/1962,1962-02-03,1962,2
04/02/1962,0.0,2.8,34.0,13.0,04/02/1962,1962-02-04,1962,2
05/02/1962,0.0,2.8,34.0,12.0,05/02/1962,1962-02-05,1962,2
06/02/1962,0.0,4.3,34.0,15.0,06/02/1962,1962-02-06,1962,2
07/02/1962,0.0,4.1,34.0,12.5,07/02/1962,1962-02-07,1962,2
08/02/1962,0.0,3.9,33.0,10.5,08/02/1962,1962-02-08,1962,2
09/02/1962,0.0,5.1,31.0,12.0,09/02/1962,1962-02-09,1962,2
10/02/1962,0.0,5.8,37.5,15.0,10/02/1962,1962-02-10,1962,2
11/02/1962,0.0,6.9,29.0,13.5,11/02/1962,1962-02-11,1962,2
12/02/1962,0.0,4.4,32.5,15.0,12/02/1962,1962-02-12,1962,2
13/02/1962,0.0,3.4,33.0,12.5,13/02/1962,1962-02-13,1962,2
14/02/1962,0.0,4.9,29.5,13.5,14/02/1962,1962-02-14,1962,2
15/02/1962,0.0,5.6,35.0,13.5,15/02/1962,1962-02-15,1962,2
16/02/1962,0.0,6.0,34.5,10.5,16/02/1962,1962-02-16,1962,2
17/02/1962,0.0,5.4,32.0,10.0,17/02/1962,1962-02-17,1962,2
18/02/1962,0.0,5.4,32.0,7.0,18/02/1962,1962-02-18,1962,2
19/02/1962,0.0,3.8,33.5,8.0,19/02/1962,1962-02-19,1962,2
20/02/1962,0.0,3.4,27.0,13.0,20/02/1962,1962-02-20,1962,2
21/02/1962,0.0,4.0,27.5,11.0,21/02/1962,1962-02-21,1962,2
22/02/1962,0.0,2.7,27.5,11.0,22/02/1962,1962-02-22,1962,2
23/02/1962,0.0,5.9,29.5,6.0,23/02/1962,1962-02-23,1962,2
24/02/1962,0.0,4.3,30.0,6.5,24/02/1962,1962-02-24,1962,2
25/02/1962,0.0,4.2,30.5,7.0,25/02/1962,1962-02-25,1962,2
26/02/1962,0.0,4.3,32.0,6.5,26/02/1962,1962-02-26,1962,2
27/02/1962,0.0,3.6,30.0,7.5,27/02/1962,1962-02-27,1962,2
28/02/1962,0.0,3.4,34.5,5.5,28/02/1962,1962-02-28,1962,2
01/03/1962,0.0,5.3,34.0,5.5,01/03/1962,1962-03-01,1962,3
02/03/1962,0.0,4.4,33.0,5.5,02/03/1962,1962-03-02,1962,3
03/03/1962,0.0,4.6,33.0,9.0,03/03/1962,1962-03-03,1962,3
04/03/1962,0.0,7.2,38.5,8.0,04/03/1962,1962-03-04,1962,3
05/03/1962,0.0,7.3,27.0,8.5,05/03/1962,1962-03-05,1962,3
06/03/1962,0.0,7.0,40.0,10.5,06/03/1962,1962-03-06,1962,3
07/03/1962,0.0,7.0,33.0,10.5,07/03/1962,1962-03-07,1962,3
08/03/1962,0.0,6.5,33.5,13.5,08/03/1962,1962-03-08,1962,3
09/03/1962,2.5,0.5,17.0,14.0,09/03/1962,1962-03-09,1962,3
10/03/1962,0.0,2.3,36.5,9.5,10/03/1962,1962-03-10,1962,3
11/03/1962,0.0,6.2,39.0,6.0,11/03/1962,1962-03-11,1962,3
12/03/1962,0.0,4.8,39.5,5.0,12/03/1962,1962-03-12,1962,3
13/03/1962,0.0,4.5,34.0,5.5,13/03/1962,1962-03-13,1962,3
14/03/1962,0.0,4.8,29.0,5.0,14/03/1962,1962-03-14,1962,3
15/03/1962,0.0,6.7,29.5,5.5,15/03/1962,1962-03-15,1962,3
16/03/1962,0.0,9.0,34.5,5.5,16/03/1962,1962-03-16,1962,3
17/03/1962,0.0,6.1,34.0,10.0,17/03/1962,1962-03-17,1962,3
18/03/1962,0.0,7.8,35.0,13.5,18/03/1962,1962-03-18,1962,3
19/03/1962,0.0,3.6,30.0,10.0,19/03/1962,1962-03-19,1962,3
20/03/1962,0.0,4.9,33.0,12.0,20/03/1962,1962-03-20,1962,3
21/03/1962,0.0,5.8,38.0,9.0,21/03/1962,1962-03-21,1962,3
22/03/1962,0.0,7.5,36.0,9.0,22/03/1962,1962-03-22,1962,3
23/03/1962,0.0,4.0,34.5,7.0,23/03/1962,1962-03-23,1962,3
24/03/1962,0.0,3.9,39.0,7.0,24/03/1962,1962-03-24,1962,3
25/03/1962,0.0,5.1,42.0,9.0,25/03/1962,1962-03-25,1962,3
26/03/1962,0.0,5.9,40.0,11.0,26/03/1962,1962-03-26,1962,3
27/03/1962,0.0,5.6,48.0,10.5,27/03/1962,1962-03-27,1962,3
28/03/1962,0.0,6.3,37.5,12.0,28/03/1962,1962-03-28,1962,3
29/03/1962,0.0,6.8,38.0,12.0,29/03/1962,1962-03-29,1962,3
30/03/1962,0.0,6.7,43.0,13.5,30/03/1962,1962-03-30,1962,3
31/03/1962,0.0,4.6,32.0,10.0,31/03/1962,1962-03-31,1962,3
01/04/1962,0.0,5.9,40.0,10.0,01/04/1962,1962-04-01,1962,4
02/04/1962,0.0,6.0,39.0,14.0,02/04/1962,1962-04-02,1962,4
03/04/1962,0.0,3.7,32.5,12.5,03/04/1962,1962-04-03,1962,4
04/04/1962,0.0,4.7,34.0,13.0,04/04/1962,1962-04-04,1962,4
05/04/1962,0.0,11.1,40.0,14.0,05/04/1962,1962-04-05,1962,4
06/04/1962,0.0,10.5,39.5,10.5,06/04/1962,1962-04-06,1962,4
07/04/1962,0.0,9.7,41.0,19.0,07/04/1962,1962-04-07,1962,4
08/04/1962,0.0,11.7,39.5,12.5,08/04/1962,1962-04-08,1962,4
09/04/1962,0.0,10.6,39.0,12.0,09/04/1962,1962-04-09,1962,4
10/04/1962,0.0,4.6,41.0,12.5,10/04/1962,1962-04-10,1962,4
11/04/1962,0.0,6.2,41.5,12.0,11/04/1962,1962-04-11,1962,4
12/04/1962,0.0,6.9,43.0,15.0,12/04/1962,1962-04-12,1962,4
13/04/1962,0.0,5.9,42.5,16.0,13/04/1962,1962-04-13,1962,4
14/04/1962,0.0,6.0,42.0,19.0,14/04/1962,1962-04-14,1962,4
15/04/1962,0.0,7.1,43.0,17.0,15/04/1962,1962-04-15,1962,4
16/04/1962,0.0,7.5,45.0,18.0,16/04/1962,1962-04-16,1962,4
17/04/1962,0.0,6.9,45.0,18.0,17/04/1962,1962-04-17,1962,4
18/04/1962,0.0,6.9,44.0,17.0,18/04/1962,1962-04-18,1962,4
19/04/1962,0.0,4.8,45.5,17.0,19/04/1962,1962-04-19,1962,4
20/04/1962,0.0,6.0,45.0,16.5,20/04/1962,1962-04-20,1962,4
21/04/1962,0.0,7.0,46.0,18.5,21/04/1962,1962-04-21,1962,4
22/04/1962,0.0,7.5,43.0,18.0,22/04/1962,1962-04-22,1962,4
23/04/1962,0.0,7.1,42.0,16.0,23/04/1962,1962-04-23,1962,4
24/04/1962,0.0,7.1,39.0,17.0,24/04/1962,1962-04-24,1962,4
25/04/1962,0.0,9.8,40.5,17.0,25/04/1962,1962-04-25,1962,4
26/04/1962,0.0,10.7,42.0,14.5,26/04/1962,1962-04-26,1962,4
27/04/1962,0.0,10.2,44.0,10.5,27/04/1962,1962-04-27,1962,4
28/04/1962,0.0,8.4,42.0,13.5,28/04/1962,1962-04-28,1962,4
29/04/1962,0.0,6.0,40.0,13.5,29/04/1962,1962-04-29,1962,4
30/04/1962,0.0,7.0,43.0,16.0,30/04/1962,1962-04-30,1962,4
01/05/1962,0.0,7.8,42.5,17.0,01/05/1962,1962-05-01,1962,5
02/05/1962,0.0,7.0,42.0,16.0,02/05/1962,1962-05-02,1962,5
03/05/1962,0.0,7.0,41.0,19.0,03/05/1962,1962-05-03,1962,5
04/05/1962,0.0,11.5,43.0,18.5,04/05/1962,1962-05-04,1962,5
05/05/1962,0.0,6.3,43.0,19.0,05/05/1962,1962-05-05,1962,5
06/05/1962,0.0,13.0,44.0,19.0,06/05/1962,1962-05-06,1962,5
07/05/1962,0.0,14.6,44.5,20.0,07/05/1962,1962-05-07,1962,5
08/05/1962,0.0,11.9,42.5,19.0,08/05/1962,1962-05-08,1962,5
09/05/1962,0.0,12.0,42.5,11.0,09/05/1962,1962-05-09,1962,5
10/05/1962,0.0,7.9,42.5,11.0,10/05/1962,1962-05-10,1962,5
11/05/1962,0.0,12.6,39.0,11.0,11/05/1962,1962-05-11,1962,5
12/05/1962,0.0,9.8,35.0,12.5,12/05/1962,1962-05-12,1962,5
13/05/1962,0.0,10.4,35.5,11.0,13/05/1962,1962-05-13,1962,5
14/05/1962,0.0,10.4,35.5,18.5,14/05/1962,1962-05-14,1962,5
15/05/1962,0.0,11.0,35.5,18.5,15/05/1962,1962-05-15,1962,5
16/05/1962,0.0,6.3,36.5,17.5,16/05/1962,1962-05-16,1962,5
17/05/1962,0.0,7.4,34.5,16.0,17/05/1962,1962-05-17,1962,5
18/05/1962,0.0,15.7,39.0,17.0,18/05/1962,1962-05-18,1962,5
19/05/1962,0.0,12.8,40.0,17.0,19/05/1962,1962-05-19,1962,5
20/05/1962,0.0,6.3,40.5,19.0,20/05/1962,1962-05-20,1962,5
21/05/1962,0.0,6.8,40.0,20.5,21/05/1962,1962-05-21,1962,5
22/05/1962,0.0,12.3,40.5,17.5,22/05/1962,1962-05-22,1962,5
23/05/1962,0.0,14.0,40.0,16.5,23/05/1962,1962-05-23,1962,5
24/05/1962,0.0,12.1,40.0,17.5,24/05/1962,1962-05-24,1962,5
25/05/1962,0.0,12.3,40.0,16.5,25/05/1962,1962-05-25,1962,5
26/05/1962,0.0,10.1,39.5,15.5,26/05/1962,1962-05-26,1962,5
27/05/1962,0.0,9.4,37.5,16.0,27/05/1962,1962-05-27,1962,5
28/05/1962,0.0,11.6,35.0,15.5,28/05/1962,1962-05-28,1962,5
29/05/1962,0.0,8.4,40.0,15.0,29/05/1962,1962-05-29,1962,5
30/05/1962,0.0,9.3,40.0,16.0,30/05/1962,1962-05-30,1962,5
31/05/1962,0.0,10.8,38.5,16.5,31/05/1962,1962-05-31,1962,5
01/06/1962,0.0,9.5,38.5,18.0,01/06/1962,1962-06-01,1962,6
02/06/1962,0.0,9.3,38.5,18.0,02/06/1962,1962-06-02,1962,6
03/06/1962,0.0,6.6,39.5,18.0,03/06/1962,1962-06-03,1962,6
04/06/1962,0.0,7.1,38.0,16.0,04/06/1962,1962-06-04,1962,6
05/06/1962,0.0,12.0,37.0,18.0,05/06/1962,1962-06-05,1962,6
06/06/1962,0.0,8.9,40.0,18.0,06/06/1962,1962-06-06,1962,6
07/06/1962,0.0,12.9,40.0,16.0,07/06/1962,1962-06-07,1962,6
08/06/1962,0.0,12.3,41.5,18.0,08/06/1962,1962-06-08,1962,6
09/06/1962,0.0,13.4,39.5,17.0,09/06/1962,1962-06-09,1962,6
10/06/1962,0.0,8.4,40.0,21.0,10/06/1962,1962-06-10,1962,6
11/06/1962,0.0,8.9,44.5,21.5,11/06/1962,1962-06-11,1962,6
12/06/1962,0.0,10.8,45.5,20.0,12/06/1962,1962-06-12,1962,6
13/06/1962,0.0,9.0,41.0,20.5,13/06/1962,1962-06-13,1962,6
14/06/1962,0.0,12.7,40.5,22.0,14/06/1962,1962-06-14,1962,6
15/06/1962,0.0,10.6,42.0,19.0,15/06/1962,1962-06-15,1962,6
16/06/1962,0.0,10.8,43.0,18.5,16/06/1962,1962-06-16,1962,6
17/06/1962,0.0,11.0,40.0,18.5,17/06/1962,1962-06-17,1962,6
18/06/1962,0.0,11.3,40.5,18.0,18/06/1962,1962-06-18,1962,6
19/06/1962,0.0,7.5,40.5,19.0,19/06/1962,1962-06-19,1962,6
20/06/1962,0.0,13.4,41.5,20.0,20/06/1962,1962-06-20,1962,6
21/06/1962,0.0,12.8,41.5,20.5,21/06/1962,1962-06-21,1962,6
22/06/1962,5.0,12.0,41.0,25.5,22/06/1962,1962-06-22,1962,6
23/06/1962,0.0,11.7,41.5,23.5,23/06/1962,1962-06-23,1962,6
24/06/1962,0.0,11.2,41.5,22.5,24/06/1962,1962-06-24,1962,6
25/06/1962,0.0,14.0,41.0,23.0,25/06/1962,1962-06-25,1962,6
26/06/1962,1.1,9.3,39.0,25.5,26/06/1962,1962-06-26,1962,6
27/06/1962,2.5,9.6,36.5,25.5,27/06/1962,1962-06-27,1962,6
28/06/1962,16.5,9.0,38.0,23.5,28/06/1962,1962-06-28,1962,6
29/06/1962,7.0,7.1,38.0,23.0,29/06/1962,1962-06-29,1962,6
30/06/1962,6.6,6.5,35.0,22.5,30/06/1962,1962-06-30,1962,6
01/07/1962,0.5,10.1,34.0,24.0,01/07/1962,1962-07-01,1962,7
02/07/1962,0.3,9.6,33.5,25.5,02/07/1962,1962-07-02,1962,7
03/07/1962,0.0,11.0,38.0,23.5,03/07/1962,1962-07-03,1962,7
04/07/1962,13.0,10.4,38.5,24.0,04/07/1962,1962-07-04,1962,7
05/07/1962,0.7,12.4,37.5,24.5,05/07/1962,1962-07-05,1962,7
06/07/1962,0.0,9.6,39.5,23.5,06/07/1962,1962-07-06,1962,7
07/07/1962,42.2,8.9,34.0,23.0,07/07/1962,1962-07-07,1962,7
08/07/1962,0.0,8.3,35.5,22.0,08/07/1962,1962-07-08,1962,7
09/07/1962,0.0,8.5,38.0,22.0,09/07/1962,1962-07-09,1962,7
10/07/1962,0.0,7.4,38.0,23.0,10/07/1962,1962-07-10,1962,7
11/07/1962,1.2,7.3,31.0,28.0,11/07/1962,1962-07-11,1962,7
12/07/1962,10.3,9.0,28.0,21.0,12/07/1962,1962-07-12,1962,7
13/07/1962,0.0,7.1,34.5,22.0,13/07/1962,1962-07-13,1962,7
14/07/1962,0.0,7.9,38.0,23.0,14/07/1962,1962-07-14,1962,7
15/07/1962,0.0,9.3,37.5,24.5,15/07/1962,1962-07-15,1962,7
16/07/1962,0.0,8.8,37.5,23.5,16/07/1962,1962-07-16,1962,7
17/07/1962,13.0,12.0,39.0,23.0,17/07/1962,1962-07-17,1962,7
18/07/1962,0.0,8.0,34.5,23.5,18/07/1962,1962-07-18,1962,7
19/07/1962,0.0,11.6,37.5,23.5,19/07/1962,1962-07-19,1962,7
20/07/1962,0.0,6.8,39.0,24.0,20/07/1962,1962-07-20,1962,7
21/07/1962,3.4,12.8,39.0,25.0,21/07/1962,1962-07-21,1962,7
22/07/1962,8.0,8.2,40.0,25.0,22/07/1962,1962-07-22,1962,7
23/07/1962,0.0,9.8,38.0,23.5,23/07/1962,1962-07-23,1962,7
24/07/1962,37.5,12.3,37.5,22.0,24/07/1962,1962-07-24,1962,7
25/07/1962,0.0,5.1,34.5,22.0,25/07/1962,1962-07-25,1962,7
26/07/1962,0.0,6.1,35.0,22.5,26/07/1962,1962-07-26,1962,7
27/07/1962,0.0,7.3,38.0,25.5,27/07/1962,1962-07-27,1962,7
28/07/1962,0.0,9.7,38.5,22.0,28/07/1962,1962-07-28,1962,7
29/07/1962,0.0,8.4,39.0,25.0,29/07/1962,1962-07-29,1962,7
30/07/1962,0.0,5.0,36.0,26.0,30/07/1962,1962-07-30,1962,7
31/07/1962,0.0,6.6,39.0,24.0,31/07/1962,1962-07-31,1962,7
01/08/1962,0.0,7.1,38.0,24.0,01/08/1962,1962-08-01,1962,8
02/08/1962,0.0,6.7,39.5,24.5,02/08/1962,1962-08-02,1962,8
03/08/1962,0.0,5.0,40.0,25.0,03/08/1962,1962-08-03,1962,8
04/08/1962,27.0,6.7,37.5,25.0,04/08/1962,1962-08-04,1962,8
05/08/1962,0.0,9.2,35.5,22.0,05/08/1962,1962-08-05,1962,8
06/08/1962,7.4,16.8,38.5,24.5,06/08/1962,1962-08-06,1962,8
07/08/1962,5.3,12.0,36.0,23.0,07/08/1962,1962-08-07,1962,8
08/08/1962,0.0,10.9,35.0,22.5,08/08/1962,1962-08-08,1962,8
09/08/1962,0.0,9.1,38.0,24.0,09/08/1962,1962-08-09,1962,8
10/08/1962,0.0,10.4,39.5,25.0,10/08/1962,1962-08-10,1962,8
11/08/1962,2.7,11.7,38.5,24.0,11/08/1962,1962-08-11,1962,8
12/08/1962,0.0,8.0,39.5,22.5,12/08/1962,1962-08-12,1962,8
13/08/1962,0.0,6.7,38.0,23.0,13/08/1962,1962-08-13,1962,8
14/08/1962,0.0,7.0,39.0,22.5,14/08/1962,1962-08-14,1962,8
15/08/1962,0.0,9.3,36.5,23.5,15/08/1962,1962-08-15,1962,8
16/08/1962,0.0,4.5,41.5,26.0,16/08/1962,1962-08-16,1962,8
17/08/1962,9.8,7.9,39.0,25.0,17/08/1962,1962-08-17,1962,8
18/08/1962,2.8,5.2,38.0,24.0,18/08/1962,1962-08-18,1962,8
19/08/1962,0.0,9.6,36.5,23.5,19/08/1962,1962-08-19,1962,8
20/08/1962,60.5,11.5,38.0,25.0,20/08/1962,1962-08-20,1962,8
21/08/1962,4.5,11.4,35.0,22.5,21/08/1962,1962-08-21,1962,8
22/08/1962,2.8,9.2,34.0,22.0,22/08/1962,1962-08-22,1962,8
23/08/1962,0.0,6.6,34.0,22.0,23/08/1962,1962-08-23,1962,8
24/08/1962,19.5,8.7,35.0,23.0,24/08/1962,1962-08-24,1962,8
25/08/1962,0.0,6.9,35.0,23.0,25/08/1962,1962-08-25,1962,8
26/08/1962,0.0,9.3,38.0,23.5,26/08/1962,1962-08-26,1962,8
27/08/1962,0.0,8.2,36.0,24.5,27/08/1962,1962-08-27,1962,8
28/08/1962,0.0,8.6,36.0,25.0,28/08/1962,1962-08-28,1962,8
29/08/1962,0.0,8.7,37.0,25.5,29/08/1962,1962-08-29,1962,8
30/08/1962,0.0,7.6,38.5,26.0,30/08/1962,1962-08-30,1962,8
31/08/1962,1.9,7.1,39.0,25.5,31/08/1962,1962-08-31,1962,8
01/09/1962,0.0,8.1,38.5,24.0,01/09/1962,1962-09-01,1962,9
02/09/1962,34.2,6.3,38.0,23.0,02/09/1962,1962-09-02,1962,9
03/09/1962,35.7,7.2,32.0,23.5,03/09/1962,1962-09-03,1962,9
04/09/1962,0.0,6.4,34.5,24.0,04/09/1962,1962-09-04,1962,9
05/09/1962,0.0,8.2,34.0,24.5,05/09/1962,1962-09-05,1962,9
06/09/1962,21.5,6.0,34.0,25.0,06/09/1962,1962-09-06,1962,9
07/09/1962,13.9,7.8,32.0,22.5,07/09/1962,1962-09-07,1962,9
08/09/1962,0.0,7.5,32.5,22.0,08/09/1962,1962-09-08,1962,9
09/09/1962,0.0,6.1,34.0,23.0,09/09/1962,1962-09-09,1962,9
10/09/1962,2.5,7.2,34.0,22.5,10/09/1962,1962-09-10,1962,9
11/09/1962,0.0,8.1,34.5,24.0,11/09/1962,1962-09-11,1962,9
12/09/1962,0.0,8.0,34.5,23.5,12/09/1962,1962-09-12,1962,9
13/09/1962,0.0,9.0,34.0,23.0,13/09/1962,1962-09-13,1962,9
14/09/1962,1.2,10.1,34.0,24.0,14/09/1962,1962-09-14,1962,9
15/09/1962,0.0,5.2,36.5,23.0,15/09/1962,1962-09-15,1962,9
16/09/1962,1.0,6.5,36.0,25.5,16/09/1962,1962-09-16,1962,9
17/09/1962,0.0,9.6,34.0,23.0,17/09/1962,1962-09-17,1962,9
18/09/1962,0.0,8.1,38.5,24.5,18/09/1962,1962-09-18,1962,9
19/09/1962,0.0,7.2,38.0,25.0,19/09/1962,1962-09-19,1962,9
20/09/1962,3.3,5.6,34.5,23.5,20/09/1962,1962-09-20,1962,9
21/09/1962,0.0,5.9,34.0,23.5,21/09/1962,1962-09-21,1962,9
22/09/1962,0.0,5.7,36.0,23.0,22/09/1962,1962-09-22,1962,9
23/09/1962,0.0,4.8,36.0,23.5,23/09/1962,1962-09-23,1962,9
24/09/1962,0.0,7.1,35.0,24.0,24/09/1962,1962-09-24,1962,9
25/09/1962,18.3,7.8,36.0,24.5,25/09/1962,1962-09-25,1962,9
26/09/1962,0.0,4.9,35.0,23.0,26/09/1962,1962-09-26,1962,9
27/09/1962,0.0,5.6,37.0,23.0,27/09/1962,1962-09-27,1962,9
28/09/1962,0.0,6.3,33.0,23.5,28/09/1962,1962-09-28,1962,9
29/09/1962,0.0,7.6,37.5,23.0,29/09/1962,1962-09-29,1962,9
30/09/1962,0.0,9.6,39.5,24.0,30/09/1962,1962-09-30,1962,9
01/10/1962,0.0,9.0,38.5,23.0,01/10/1962,1962-10-01,1962,10
02/10/1962,0.0,7.2,39.0,23.5,02/10/1962,1962-10-02,1962,10
03/10/1962,0.0,8.5,39.0,23.0,03/10/1962,1962-10-03,1962,10
04/10/1962,52.2,12.6,32.0,22.0,04/10/1962,1962-10-04,1962,10
05/10/1962,0.0,11.6,33.0,20.5,05/10/1962,1962-10-05,1962,10
06/10/1962,0.0,8.1,34.5,20.5,06/10/1962,1962-10-06,1962,10
07/10/1962,0.0,5.3,33.0,18.5,07/10/1962,1962-10-07,1962,10
08/10/1962,0.0,3.0,33.5,19.5,08/10/1962,1962-10-08,1962,10
09/10/1962,0.0,5.4,33.5,22.5,09/10/1962,1962-10-09,1962,10
10/10/1962,7.1,5.1,35.0,19.5,10/10/1962,1962-10-10,1962,10
11/10/1962,0.0,7.4,34.5,21.0,11/10/1962,1962-10-11,1962,10
12/10/1962,0.0,5.6,34.0,23.0,12/10/1962,1962-10-12,1962,10
13/10/1962,0.0,5.1,35.5,22.5,13/10/1962,1962-10-13,1962,10
14/10/1962,0.0,5.4,35.0,24.5,14/10/1962,1962-10-14,1962,10
15/10/1962,1.2,5.9,35.5,22.5,15/10/1962,1962-10-15,1962,10
16/10/1962,0.6,5.8,35.0,23.5,16/10/1962,1962-10-16,1962,10
17/10/1962,0.0,5.6,34.5,22.0,17/10/1962,1962-10-17,1962,10
18/10/1962,0.0,5.3,35.5,22.5,18/10/1962,1962-10-18,1962,10
19/10/1962,0.0,6.0,34.5,22.0,19/10/1962,1962-10-19,1962,10
20/10/1962,0.0,4.5,35.0,21.5,20/10/1962,1962-10-20,1962,10
21/10/1962,0.0,8.4,38.0,17.0,21/10/1962,1962-10-21,1962,10
22/10/1962,0.0,5.6,37.0,17.0,22/10/1962,1962-10-22,1962,10
23/10/1962,0.0,4.9,37.5,17.5,23/10/1962,1962-10-23,1962,10
24/10/1962,0.0,4.5,37.0,18.5,24/10/1962,1962-10-24,1962,10
25/10/1962,0.0,5.4,36.5,19.0,25/10/1962,1962-10-25,1962,10
26/10/1962,0.0,8.6,38.0,20.5,26/10/1962,1962-10-26,1962,10
27/10/1962,0.0,9.1,37.5,19.5,27/10/1962,1962-10-27,1962,10
28/10/1962,0.0,5.1,38.5,19.5,28/10/1962,1962-10-28,1962,10
29/10/1962,0.0,10.0,38.5,18.5,29/10/1962,1962-10-29,1962,10
30/10/1962,0.0,4.9,38.0,20.5,30/10/1962,1962-10-30,1962,10
31/10/1962,0.0,6.0,39.0,21.0,31/10/1962,1962-10-31,1962,10
01/11/1962,0.0,7.0,38.5,19.0,01/11/1962,1962-11-01,1962,11
02/11/1962,0.0,6.1,37.5,18.5,02/11/1962,1962-11-02,1962,11
03/11/1962,0.0,6.2,37.5,20.5,03/11/1962,1962-11-03,1962,11
04/11/1962,2.1,9.3,34.5,18.5,04/11/1962,1962-11-04,1962,11
05/11/1962,0.0,8.8,34.5,19.5,05/11/1962,1962-11-05,1962,11
06/11/1962,0.0,7.8,34.0,15.5,06/11/1962,1962-11-06,1962,11
07/11/1962,0.0,7.2,34.5,16.0,07/11/1962,1962-11-07,1962,11
08/11/1962,0.0,10.6,36.0,18.5,08/11/1962,1962-11-08,1962,11
09/11/1962,0.0,9.6,36.0,16.5,09/11/1962,1962-11-09,1962,11
10/11/1962,0.0,9.8,35.0,17.0,10/11/1962,1962-11-10,1962,11
11/11/1962,0.0,7.9,34.5,17.5,11/11/1962,1962-11-11,1962,11
12/11/1962,0.0,8.3,34.0,18.0,12/11/1962,1962-11-12,1962,11
13/11/1962,0.0,7.5,38.0,16.5,13/11/1962,1962-11-13,1962,11
14/11/1962,0.0,6.8,38.0,16.5,14/11/1962,1962-11-14,1962,11
15/11/1962,0.0,6.9,36.0,17.5,15/11/1962,1962-11-15,1962,11
16/11/1962,0.0,6.2,36.0,18.5,16/11/1962,1962-11-16,1962,11
17/11/1962,0.0,4.9,31.0,16.0,17/11/1962,1962-11-17,1962,11
18/11/1962,0.0,5.8,30.5,15.5,18/11/1962,1962-11-18,1962,11
19/11/1962,0.0,6.5,29.0,15.5,19/11/1962,1962-11-19,1962,11
20/11/1962,0.0,5.9,29.5,9.5,20/11/1962,1962-11-20,1962,11
21/11/1962,0.0,5.6,29.5,5.0,21/11/1962,1962-11-21,1962,11
22/11/1962,0.0,5.2,30.3,9.5,22/11/1962,1962-11-22,1962,11
23/11/1962,0.0,4.1,27.0,12.0,23/11/1962,1962-11-23,1962,11
24/11/1962,0.0,7.4,33.5,14.0,24/11/1962,1962-11-24,1962,11
25/11/1962,0.0,7.3,37.0,10.5,25/11/1962,1962-11-25,1962,11
26/11/1962,0.0,7.1,35.5,12.0,26/11/1962,1962-11-26,1962,11
27/11/1962,0.0,6.9,33.5,10.5,27/11/1962,1962-11-27,1962,11
28/11/1962,0.0,4.0,33.0,12.0,28/11/1962,1962-11-28,1962,11
29/11/1962,1.0,4.1,32.0,11.5,29/11/1962,1962-11-29,1962,11
30/11/1962,1.9,6.0,30.5,15.0,30/11/1962,1962-11-30,1962,11
01/12/1962,0.0,7.3,27.0,12.5,01/12/1962,1962-12-01,1962,12
02/12/1962,0.0,4.7,29.0,10.0,02/12/1962,1962-12-02,1962,12
03/12/1962,0.0,5.5,28.5,15.0,03/12/1962,1962-12-03,1962,12
04/12/1962,0.0,4.1,28.5,10.0,04/12/1962,1962-12-04,1962,12
05/12/1962,0.0,8.5,29.0,10.5,05/12/1962,1962-12-05,1962,12
06/12/1962,0.0,5.4,30.0,10.0,06/12/1962,1962-12-06,1962,12
07/12/1962,0.0,7.2,32.5,9.0,07/12/1962,1962-12-07,1962,12
08/12/1962,0.0,6.6,32.0,11.5,08/12/1962,1962-12-08,1962,12
09/12/1962,0.0,5.4,33.0,14.0,09/12/1962,1962-12-09,1962,12
10/12/1962,0.0,5.1,32.0,15.0,10/12/1962,1962-12-10,1962,12
11/12/1962,0.0,7.8,29.5,15.0,11/12/1962,1962-12-11,1962,12
12/12/1962,0.0,7.2,33.5,18.5,12/12/1962,1962-12-12,1962,12
13/12/1962,0.0,6.7,30.0,12.0,13/12/1962,1962-12-13,1962,12
14/12/1962,0.0,4.9,31.5,12.5,14/12/1962,1962-12-14,1962,12
15/12/1962,0.0,7.1,32.5,14.5,15/12/1962,1962-12-15,1962,12
16/12/1962,0.0,5.4,27.5,15.0,16/12/1962,1962-12-16,1962,12
17/12/1962,10.0,2.7,28.5,19.0,17/12/1962,1962-12-17,1962,12
18/12/1962,19.0,2.2,22.0,16.5,18/12/1962,1962-12-18,1962,12
19/12/1962,0.0,1.3,22.5,6.5,19/12/1962,1962-12-19,1962,12
20/12/1962,0.0,2.8,25.5,15.0,20/12/1962,1962-12-20,1962,12
21/12/1962,0.1,2.7,22.0,12.5,21/12/1962,1962-12-21,1962,12
22/12/1962,0.2,2.4,22.5,14.0,22/12/1962,1962-12-22,1962,12
23/12/1962,0.0,1.6,22.5,13.0,23/12/1962,1962-12-23,1962,12
24/12/1962,0.0,5.5,21.5,12.5,24/12/1962,1962-12-24,1962,12
25/12/1962,0.0,4.2,26.0,10.5,25/12/1962,1962-12-25,1962,12
26/12/1962,0.0,4.5,27.5,11.0,26/12/1962,1962-12-26,1962,12
27/12/1962,0.0,1.5,25.5,10.5,27/12/1962,1962-12-27,1962,12
28/12/1962,0.0,5.4,26.0,10.0,28/12/1962,1962-12-28,1962,12
29/12/1962,0.0,7.6,27.5,7.0,29/12/1962,1962-12-29,1962,12
30/12/1962,0.0,5.8,30.0,11.5,30/12/1962,1962-12-30,1962,12
31/12/1962,0.0,4.7,31.0,11.0,31/12/1962,1962-12-31,1962,12
01/01/1963,0.0,4.4,30.5,12.5,01/01/1963,1963-01-01,1963,1
02/01/1963,0.0,4.7,25.5,12.0,02/01/1963,1963-01-02,1963,1
03/01/1963,3.4,8.1,23.5,15.5,03/01/1963,1963-01-03,1963,1
04/01/1963,0.0,5.8,24.0,12.5,04/01/1963,1963-01-04,1963,1
05/01/1963,0.0,4.7,26.5,14.5,05/01/1963,1963-01-05,1963,1
06/01/1963,0.0,3.7,27.5,17.5,06/01/1963,1963-01-06,1963,1
07/01/1963,0.0,3.8,30.0,14.0,07/01/1963,1963-01-07,1963,1
08/01/1963,0.0,3.1,30.5,15.0,08/01/1963,1963-01-08,1963,1
09/01/1963,0.0,3.7,30.0,15.0,09/01/1963,1963-01-09,1963,1
10/01/1963,1.5,3.1,29.0,13.5,10/01/1963,1963-01-10,1963,1
11/01/1963,0.0,3.0,25.0,11.0,11/01/1963,1963-01-11,1963,1
12/01/1963,0.0,2.3,23.0,11.5,12/01/1963,1963-01-12,1963,1
13/01/1963,0.0,4.8,21.0,10.0,13/01/1963,1963-01-13,1963,1
14/01/1963,0.0,2.4,25.0,3.0,14/01/1963,1963-01-14,1963,1
15/01/1963,0.0,4.3,29.0,4.0,15/01/1963,1963-01-15,1963,1
16/01/1963,0.0,4.1,27.0,6.0,16/01/1963,1963-01-16,1963,1
17/01/1963,0.0,4.0,27.5,7.0,17/01/1963,1963-01-17,1963,1
18/01/1963,0.0,2.2,29.0,8.0,18/01/1963,1963-01-18,1963,1
19/01/1963,0.0,3.8,29.0,7.5,19/01/1963,1963-01-19,1963,1
20/01/1963,0.0,3.5,25.5,7.0,20/01/1963,1963-01-20,1963,1
21/01/1963,0.0,4.0,28.0,5.5,21/01/1963,1963-01-21,1963,1
22/01/1963,0.0,4.9,28.0,6.5,22/01/1963,1963-01-22,1963,1
23/01/1963,0.0,3.9,29.5,11.5,23/01/1963,1963-01-23,1963,1
24/01/1963,0.0,3.1,32.0,8.0,24/01/1963,1963-01-24,1963,1
25/01/1963,0.0,4.3,32.0,10.5,25/01/1963,1963-01-25,1963,1
26/01/1963,0.0,8.1,31.5,10.0,26/01/1963,1963-01-26,1963,1
27/01/1963,0.0,6.0,32.0,11.5,27/01/1963,1963-01-27,1963,1
28/01/1963,0.0,4.7,31.5,12.5,28/01/1963,1963-01-28,1963,1
29/01/1963,0.0,3.3,30.0,12.0,29/01/1963,1963-01-29,1963,1
30/01/1963,0.0,4.5,31.0,10.5,30/01/1963,1963-01-30,1963,1
31/01/1963,0.0,6.0,38.0,16.5,31/01/1963,1963-01-31,1963,1
01/02/1963,0.0,7.1,38.5,17.5,01/02/1963,1963-02-01,1963,2
02/02/1963,0.0,6.5,39.0,12.0,02/02/1963,1963-02-02,1963,2
03/02/1963,0.0,8.0,38.0,12.5,03/02/1963,1963-02-03,1963,2
04/02/1963,0.0,6.8,37.5,16.0,04/02/1963,1963-02-04,1963,2
05/02/1963,0.0,7.6,37.5,15.0,05/02/1963,1963-02-05,1963,2
06/02/1963,0.0,6.2,39.0,13.0,06/02/1963,1963-02-06,1963,2
07/02/1963,0.0,6.2,34.0,14.0,07/02/1963,1963-02-07,1963,2
08/02/1963,0.0,5.8,32.5,13.5,08/02/1963,1963-02-08,1963,2
09/02/1963,0.0,4.1,28.5,15.5,09/02/1963,1963-02-09,1963,2
10/02/1963,10.6,3.0,23.0,15.0,10/02/1963,1963-02-10,1963,2
11/02/1963,0.0,3.1,29.0,15.0,11/02/1963,1963-02-11,1963,2
12/02/1963,0.0,3.9,21.0,8.0,12/02/1963,1963-02-12,1963,2
13/02/1963,0.0,6.7,26.0,8.5,13/02/1963,1963-02-13,1963,2
14/02/1963,0.0,4.3,26.5,6.5,14/02/1963,1963-02-14,1963,2
15/02/1963,0.0,3.0,28.5,6.0,15/02/1963,1963-02-15,1963,2
16/02/1963,0.0,3.2,27.5,7.5,16/02/1963,1963-02-16,1963,2
17/02/1963,12.0,4.6,22.0,10.0,17/02/1963,1963-02-17,1963,2
18/02/1963,0.0,4.3,25.5,7.5,18/02/1963,1963-02-18,1963,2
19/02/1963,0.0,5.7,25.5,10.5,19/02/1963,1963-02-19,1963,2
20/02/1963,0.0,3.8,33.0,9.0,20/02/1963,1963-02-20,1963,2
21/02/1963,0.0,4.1,32.0,10.0,21/02/1963,1963-02-21,1963,2
22/02/1963,0.0,4.0,35.5,12.5,22/02/1963,1963-02-22,1963,2
23/02/1963,0.0,4.3,25.0,10.0,23/02/1963,1963-02-23,1963,2
24/02/1963,0.0,4.7,29.0,9.5,24/02/1963,1963-02-24,1963,2
25/02/1963,0.0,9.5,32.0,10.5,25/02/1963,1963-02-25,1963,2
26/02/1963,0.0,10.7,31.0,13.0,26/02/1963,1963-02-26,1963,2
27/02/1963,0.0,9.1,34.0,14.5,27/02/1963,1963-02-27,1963,2
28/02/1963,0.0,5.8,31.5,11.0,28/02/1963,1963-02-28,1963,2
01/03/1963,0.0,6.6,33.5,0.0,01/03/1963,1963-03-01,1963,3
02/03/1963,0.0,9.1,33.0,0.0,02/03/1963,1963-03-02,1963,3
03/03/1963,0.0,7.3,31.0,0.0,03/03/1963,1963-03-03,1963,3
04/03/1963,0.0,7.1,29.0,-1.5,04/03/1963,1963-03-04,1963,3
05/03/1963,0.0,6.1,29.5,-1.5,05/03/1963,1963-03-05,1963,3
06/03/1963,0.0,6.9,31.5,1.5,06/03/1963,1963-03-06,1963,3
07/03/1963,0.0,7.5,33.5,-2.0,07/03/1963,1963-03-07,1963,3
08/03/1963,0.0,7.5,34.5,-1.0,08/03/1963,1963-03-08,1963,3
09/03/1963,0.0,4.6,31.5,-1.0,09/03/1963,1963-03-09,1963,3
10/03/1963,0.0,6.1,33.0,-1.5,10/03/1963,1963-03-10,1963,3
11/03/1963,0.0,8.1,32.5,-4.5,11/03/1963,1963-03-11,1963,3
12/03/1963,0.0,7.8,33.0,-6.5,12/03/1963,1963-03-12,1963,3
13/03/1963,0.0,7.9,34.5,-3.5,13/03/1963,1963-03-13,1963,3
14/03/1963,0.0,7.3,35.0,0.0,14/03/1963,1963-03-14,1963,3
15/03/1963,0.0,5.8,30.5,3.0,15/03/1963,1963-03-15,1963,3
16/03/1963,0.0,6.3,31.0,5.0,16/03/1963,1963-03-16,1963,3
17/03/1963,0.0,7.8,30.0,8.0,17/03/1963,1963-03-17,1963,3
18/03/1963,0.0,7.3,31.5,1.0,18/03/1963,1963-03-18,1963,3
19/03/1963,0.0,4.8,32.0,0.0,19/03/1963,1963-03-19,1963,3
20/03/1963,0.0,7.6,32.5,1.0,20/03/1963,1963-03-20,1963,3
21/03/1963,0.0,5.9,34.0,2.5,21/03/1963,1963-03-21,1963,3
22/03/1963,0.0,6.6,34.5,3.0,22/03/1963,1963-03-22,1963,3
23/03/1963,0.0,8.1,34.0,4.5,23/03/1963,1963-03-23,1963,3
24/03/1963,0.0,8.2,38.0,5.5,24/03/1963,1963-03-24,1963,3
25/03/1963,0.0,8.2,40.0,4.5,25/03/1963,1963-03-25,1963,3
26/03/1963,0.0,6.8,41.5,9.5,26/03/1963,1963-03-26,1963,3
27/03/1963,0.0,6.6,38.0,4.5,27/03/1963,1963-03-27,1963,3
28/03/1963,0.0,6.5,38.5,4.0,28/03/1963,1963-03-28,1963,3
29/03/1963,0.0,7.6,37.0,7.0,29/03/1963,1963-03-29,1963,3
30/03/1963,0.0,8.8,34.5,6.0,30/03/1963,1963-03-30,1963,3
31/03/1963,0.0,7.7,33.0,8.0,31/03/1963,1963-03-31,1963,3
01/04/1963,0.0,7.9,33.0,13.0,01/04/1963,1963-04-01,1963,4
02/04/1963,0.0,7.6,33.0,13.0,02/04/1963,1963-04-02,1963,4
03/04/1963,0.0,10.4,32.5,15.0,03/04/1963,1963-04-03,1963,4
04/04/1963,0.0,6.9,34.5,16.5,04/04/1963,1963-04-04,1963,4
05/04/1963,0.0,10.1,37.5,10.5,05/04/1963,1963-04-05,1963,4
06/04/1963,0.0,7.7,38.0,11.5,06/04/1963,1963-04-06,1963,4
07/04/1963,0.0,7.2,38.5,12.0,07/04/1963,1963-04-07,1963,4
08/04/1963,0.0,9.3,37.0,13.5,08/04/1963,1963-04-08,1963,4
09/04/1963,0.0,10.0,37.5,13.0,09/04/1963,1963-04-09,1963,4
10/04/1963,0.0,8.7,34.5,14.0,10/04/1963,1963-04-10,1963,4
11/04/1963,0.0,10.5,37.0,15.5,11/04/1963,1963-04-11,1963,4
12/04/1963,0.0,8.2,40.5,15.5,12/04/1963,1963-04-12,1963,4
13/04/1963,0.0,8.3,41.0,15.0,13/04/1963,1963-04-13,1963,4
14/04/1963,0.0,6.8,41.0,15.0,14/04/1963,1963-04-14,1963,4
15/04/1963,0.0,5.4,40.5,14.0,15/04/1963,1963-04-15,1963,4
16/04/1963,0.0,8.9,37.0,15.5,16/04/1963,1963-04-16,1963,4
17/04/1963,0.0,8.4,36.0,15.0,17/04/1963,1963-04-17,1963,4
18/04/1963,0.0,10.3,35.0,13.0,18/04/1963,1963-04-18,1963,4
19/04/1963,0.0,9.5,36.0,13.5,19/04/1963,1963-04-19,1963,4
20/04/1963,0.0,10.4,36.0,12.0,20/04/1963,1963-04-20,1963,4
21/04/1963,0.0,8.9,39.0,12.5,21/04/1963,1963-04-21,1963,4
22/04/1963,0.0,8.1,33.0,15.5,22/04/1963,1963-04-22,1963,4
23/04/1963,0.0,7.7,32.0,16.5,23/04/1963,1963-04-23,1963,4
24/04/1963,0.0,8.9,40.0,17.0,24/04/1963,1963-04-24,1963,4
25/04/1963,0.0,8.8,41.5,18.0,25/04/1963,1963-04-25,1963,4
26/04/1963,0.0,9.2,36.5,20.0,26/04/1963,1963-04-26,1963,4
27/04/1963,0.0,9.2,36.5,17.5,27/04/1963,1963-04-27,1963,4
28/04/1963,0.0,7.0,36.0,14.0,28/04/1963,1963-04-28,1963,4
29/04/1963,0.0,9.5,39.0,13.5,29/04/1963,1963-04-29,1963,4
30/04/1963,0.0,8.8,40.0,17.0,30/04/1963,1963-04-30,1963,4
01/05/1963,0.0,7.7,36.5,16.0,01/05/1963,1963-05-01,1963,5
02/05/1963,0.0,9.9,38.0,16.0,02/05/1963,1963-05-02,1963,5
03/05/1963,0.0,8.3,38.5,16.5,03/05/1963,1963-05-03,1963,5
04/05/1963,0.0,7.8,38.0,16.5,04/05/1963,1963-05-04,1963,5
05/05/1963,0.0,8.7,40.5,15.5,05/05/1963,1963-05-05,1963,5
06/05/1963,0.0,9.9,39.0,16.5,06/05/1963,1963-05-06,1963,5
07/05/1963,0.0,10.8,40.0,19.0,07/05/1963,1963-05-07,1963,5
08/05/1963,0.0,10.2,36.5,19.5,08/05/1963,1963-05-08,1963,5
09/05/1963,0.0,8.0,38.5,20.0,09/05/1963,1963-05-09,1963,5
10/05/1963,0.0,11.9,39.5,18.5,10/05/1963,1963-05-10,1963,5
11/05/1963,0.0,10.0,39.5,19.0,11/05/1963,1963-05-11,1963,5
12/05/1963,0.0,9.5,40.0,17.0,12/05/1963,1963-05-12,1963,5
13/05/1963,0.0,10.3,42.0,17.5,13/05/1963,1963-05-13,1963,5
14/05/1963,0.0,9.3,40.5,20.5,14/05/1963,1963-05-14,1963,5
15/05/1963,0.0,10.8,39.5,20.5,15/05/1963,1963-05-15,1963,5
16/05/1963,0.0,9.8,40.0,20.0,16/05/1963,1963-05-16,1963,5
17/05/1963,0.0,9.9,41.5,20.0,17/05/1963,1963-05-17,1963,5
18/05/1963,0.0,9.3,41.0,19.5,18/05/1963,1963-05-18,1963,5
19/05/1963,0.0,10.4,41.0,19.5,19/05/1963,1963-05-19,1963,5
20/05/1963,0.0,10.3,42.0,20.5,20/05/1963,1963-05-20,1963,5
21/05/1963,0.0,11.2,42.0,19.5,21/05/1963,1963-05-21,1963,5
22/05/1963,0.0,7.1,40.5,19.0,22/05/1963,1963-05-22,1963,5
23/05/1963,0.0,11.7,43.0,19.5,23/05/1963,1963-05-23,1963,5
24/05/1963,0.0,10.8,44.0,20.0,24/05/1963,1963-05-24,1963,5
25/05/1963,0.0,11.8,44.0,22.0,25/05/1963,1963-05-25,1963,5
26/05/1963,0.0,11.3,44.5,22.5,26/05/1963,1963-05-26,1963,5
27/05/1963,0.0,10.3,43.5,21.0,27/05/1963,1963-05-27,1963,5
28/05/1963,0.0,10.1,44.5,20.5,28/05/1963,1963-05-28,1963,5
29/05/1963,0.0,11.5,44.0,20.0,29/05/1963,1963-05-29,1963,5
30/05/1963,0.0,13.1,44.0,21.0,30/05/1963,1963-05-30,1963,5
31/05/1963,0.0,13.8,41.5,18.0,31/05/1963,1963-05-31,1963,5
01/06/1963,0.0,11.7,39.0,17.0,01/06/1963,1963-06-01,1963,6
02/06/1963,0.0,11.2,38.5,17.0,02/06/1963,1963-06-02,1963,6
03/06/1963,0.0,10.6,38.0,18.5,03/06/1963,1963-06-03,1963,6
04/06/1963,0.0,11.9,39.0,22.5,04/06/1963,1963-06-04,1963,6
05/06/1963,0.0,12.8,40.0,21.5,05/06/1963,1963-06-05,1963,6
06/06/1963,0.0,9.4,38.0,22.5,06/06/1963,1963-06-06,1963,6
07/06/1963,0.0,11.5,40.0,22.0,07/06/1963,1963-06-07,1963,6
08/06/1963,0.0,9.8,40.0,19.5,08/06/1963,1963-06-08,1963,6
09/06/1963,0.0,10.8,40.5,18.5,09/06/1963,1963-06-09,1963,6
10/06/1963,0.0,10.7,40.0,19.5,10/06/1963,1963-06-10,1963,6
11/06/1963,0.0,10.7,40.5,22.5,11/06/1963,1963-06-11,1963,6
12/06/1963,1.6,2.8,32.0,23.5,12/06/1963,1963-06-12,1963,6
13/06/1963,0.0,8.9,37.5,23.0,13/06/1963,1963-06-13,1963,6
14/06/1963,0.0,11.0,40.5,23.0,14/06/1963,1963-06-14,1963,6
15/06/1963,0.0,11.3,41.0,20.0,15/06/1963,1963-06-15,1963,6
16/06/1963,0.0,10.9,41.0,21.5,16/06/1963,1963-06-16,1963,6
17/06/1963,0.0,10.0,41.5,24.0,17/06/1963,1963-06-17,1963,6
18/06/1963,0.0,9.7,42.0,25.0,18/06/1963,1963-06-18,1963,6
19/06/1963,8.2,10.8,42.0,25.5,19/06/1963,1963-06-19,1963,6
20/06/1963,0.0,11.0,41.0,24.5,20/06/1963,1963-06-20,1963,6
21/06/1963,0.0,11.6,41.5,24.5,21/06/1963,1963-06-21,1963,6
22/06/1963,0.0,12.3,42.0,25.5,22/06/1963,1963-06-22,1963,6
23/06/1963,0.0,11.0,42.0,25.0,23/06/1963,1963-06-23,1963,6
24/06/1963,0.0,13.8,40.5,25.0,24/06/1963,1963-06-24,1963,6
25/06/1963,0.0,10.6,40.0,26.5,25/06/1963,1963-06-25,1963,6
26/06/1963,0.0,11.2,42.5,27.0,26/06/1963,1963-06-26,1963,6
27/06/1963,31.5,13.3,40.5,28.0,27/06/1963,1963-06-27,1963,6
28/06/1963,5.0,7.7,40.0,24.5,28/06/1963,1963-06-28,1963,6
29/06/1963,0.0,10.4,40.5,25.5,29/06/1963,1963-06-29,1963,6
30/06/1963,0.0,11.8,41.0,26.5,30/06/1963,1963-06-30,1963,6
01/07/1963,7.0,9.9,42.0,26.0,01/07/1963,1963-07-01,1963,7
02/07/1963,5.2,7.8,39.5,24.0,02/07/1963,1963-07-02,1963,7
03/07/1963,41.2,13.4,37.5,24.5,03/07/1963,1963-07-03,1963,7
04/07/1963,3.7,6.5,37.0,23.0,04/07/1963,1963-07-04,1963,7
05/07/1963,25.7,6.3,38.0,24.0,05/07/1963,1963-07-05,1963,7
06/07/1963,76.0,11.1,34.5,23.0,06/07/1963,1963-07-06,1963,7
07/07/1963,10.3,8.2,35.5,22.5,07/07/1963,1963-07-07,1963,7
08/07/1963,0.0,7.0,36.5,22.0,08/07/1963,1963-07-08,1963,7
09/07/1963,0.0,6.2,36.0,24.0,09/07/1963,1963-07-09,1963,7
10/07/1963,3.6,8.9,34.5,24.0,10/07/1963,1963-07-10,1963,7
11/07/1963,0.0,10.4,36.0,24.5,11/07/1963,1963-07-11,1963,7
12/07/1963,0.0,7.6,35.0,24.5,12/07/1963,1963-07-12,1963,7
13/07/1963,0.0,7.7,36.0,24.0,13/07/1963,1963-07-13,1963,7
14/07/1963,46.9,11.3,36.5,22.0,14/07/1963,1963-07-14,1963,7
15/07/1963,40.0,11.0,37.0,23.5,15/07/1963,1963-07-15,1963,7
16/07/1963,5.0,12.8,36.5,24.0,16/07/1963,1963-07-16,1963,7
17/07/1963,5.3,6.1,35.5,23.5,17/07/1963,1963-07-17,1963,7
18/07/1963,0.0,9.2,36.5,23.0,18/07/1963,1963-07-18,1963,7
19/07/1963,0.0,5.4,37.0,24.0,19/07/1963,1963-07-19,1963,7
20/07/1963,0.0,6.8,37.5,25.0,20/07/1963,1963-07-20,1963,7
21/07/1963,0.9,7.8,34.5,25.5,21/07/1963,1963-07-21,1963,7
22/07/1963,0.0,10.1,38.0,24.0,22/07/1963,1963-07-22,1963,7
23/07/1963,0.0,8.4,37.0,25.5,23/07/1963,1963-07-23,1963,7
24/07/1963,0.0,8.1,34.5,27.0,24/07/1963,1963-07-24,1963,7
25/07/1963,15.0,6.0,35.5,25.5,25/07/1963,1963-07-25,1963,7
26/07/1963,1.8,4.4,35.0,22.5,26/07/1963,1963-07-26,1963,7
27/07/1963,40.0,7.7,34.0,23.5,27/07/1963,1963-07-27,1963,7
28/07/1963,2.0,4.9,33.0,22.5,28/07/1963,1963-07-28,1963,7
29/07/1963,22.9,4.9,35.0,23.5,29/07/1963,1963-07-29,1963,7
30/07/1963,8.0,9.7,33.0,23.0,30/07/1963,1963-07-30,1963,7
31/07/1963,0.0,9.2,33.5,21.0,31/07/1963,1963-07-31,1963,7
01/08/1963,0.0,7.3,34.5,22.0,01/08/1963,1963-08-01,1963,8
02/08/1963,0.0,6.2,36.0,24.5,02/08/1963,1963-08-02,1963,8
03/08/1963,41.2,4.6,35.0,25.0,03/08/1963,1963-08-03,1963,8
04/08/1963,47.0,6.7,36.0,21.5,04/08/1963,1963-08-04,1963,8
05/08/1963,0.0,4.8,34.0,20.5,05/08/1963,1963-08-05,1963,8
06/08/1963,7.8,11.6,35.5,24.0,06/08/1963,1963-08-06,1963,8
07/08/1963,0.0,11.5,36.0,22.5,07/08/1963,1963-08-07,1963,8
08/08/1963,4.5,9.0,32.0,23.0,08/08/1963,1963-08-08,1963,8
09/08/1963,39.8,10.2,36.5,22.0,09/08/1963,1963-08-09,1963,8
10/08/1963,1.0,8.9,37.0,22.0,10/08/1963,1963-08-10,1963,8
11/08/1963,37.5,10.0,34.5,22.5,11/08/1963,1963-08-11,1963,8
12/08/1963,1.0,3.9,35.0,24.0,12/08/1963,1963-08-12,1963,8
13/08/1963,17.7,4.9,33.0,23.5,13/08/1963,1963-08-13,1963,8
14/08/1963,40.9,6.3,33.0,22.0,14/08/1963,1963-08-14,1963,8
15/08/1963,0.0,7.3,34.0,21.5,15/08/1963,1963-08-15,1963,8
16/08/1963,0.0,5.9,35.0,24.0,16/08/1963,1963-08-16,1963,8
17/08/1963,58.0,6.3,35.5,24.0,17/08/1963,1963-08-17,1963,8
18/08/1963,12.0,6.5,35.5,22.0,18/08/1963,1963-08-18,1963,8
19/08/1963,6.5,6.7,35.0,21.5,19/08/1963,1963-08-19,1963,8
20/08/1963,0.0,4.4,34.0,23.5,20/08/1963,1963-08-20,1963,8
21/08/1963,0.0,5.2,34.5,24.0,21/08/1963,1963-08-21,1963,8
22/08/1963,0.0,4.3,34.5,25.0,22/08/1963,1963-08-22,1963,8
23/08/1963,0.0,4.1,35.0,25.0,23/08/1963,1963-08-23,1963,8
24/08/1963,4.5,3.9,36.0,24.0,24/08/1963,1963-08-24,1963,8
25/08/1963,20.0,7.3,35.5,24.0,25/08/1963,1963-08-25,1963,8
26/08/1963,0.0,7.0,35.5,21.5,26/08/1963,1963-08-26,1963,8
27/08/1963,0.0,5.4,35.0,23.0,27/08/1963,1963-08-27,1963,8
28/08/1963,12.5,6.7,35.0,23.0,28/08/1963,1963-08-28,1963,8
29/08/1963,0.0,4.8,35.5,23.0,29/08/1963,1963-08-29,1963,8
30/08/1963,0.0,5.4,34.5,24.0,30/08/1963,1963-08-30,1963,8
31/08/1963,0.0,6.3,36.0,24.5,31/08/1963,1963-08-31,1963,8
01/09/1963,0.0,4.4,35.5,23.5,01/09/1963,1963-09-01,1963,9
02/09/1963,4.0,3.1,34.5,25.0,02/09/1963,1963-09-02,1963,9
03/09/1963,0.0,7.7,37.0,23.5,03/09/1963,1963-09-03,1963,9
04/09/1963,0.0,7.3,36.0,24.0,04/09/1963,1963-09-04,1963,9
05/09/1963,0.0,8.8,38.0,23.5,05/09/1963,1963-09-05,1963,9
06/09/1963,0.0,6.5,39.5,24.0,06/09/1963,1963-09-06,1963,9
07/09/1963,0.0,6.2,37.5,26.0,07/09/1963,1963-09-07,1963,9
08/09/1963,0.2,7.3,38.5,24.0,08/09/1963,1963-09-08,1963,9
09/09/1963,0.0,6.8,37.5,22.5,09/09/1963,1963-09-09,1963,9
10/09/1963,0.0,9.1,40.0,24.5,10/09/1963,1963-09-10,1963,9
11/09/1963,5.2,12.7,36.5,23.5,11/09/1963,1963-09-11,1963,9
12/09/1963,2.3,10.0,37.0,24.0,12/09/1963,1963-09-12,1963,9
13/09/1963,9.8,11.9,35.0,23.5,13/09/1963,1963-09-13,1963,9
14/09/1963,0.0,6.8,33.5,22.0,14/09/1963,1963-09-14,1963,9
15/09/1963,0.0,7.3,34.0,21.5,15/09/1963,1963-09-15,1963,9
16/09/1963,0.0,7.1,34.5,22.5,16/09/1963,1963-09-16,1963,9
17/09/1963,0.0,7.0,36.0,23.5,17/09/1963,1963-09-17,1963,9
18/09/1963,24.5,9.2,36.5,23.5,18/09/1963,1963-09-18,1963,9
19/09/1963,0.0,8.2,34.5,21.5,19/09/1963,1963-09-19,1963,9
20/09/1963,0.0,7.0,35.5,23.5,20/09/1963,1963-09-20,1963,9
21/09/1963,2.9,8.4,37.0,24.5,21/09/1963,1963-09-21,1963,9
22/09/1963,0.0,8.7,34.5,24.0,22/09/1963,1963-09-22,1963,9
23/09/1963,2.4,8.8,37.0,24.0,23/09/1963,1963-09-23,1963,9
24/09/1963,0.0,9.5,38.0,24.5,24/09/1963,1963-09-24,1963,9
25/09/1963,0.0,8.1,39.0,25.5,25/09/1963,1963-09-25,1963,9
26/09/1963,0.0,8.7,37.0,30.0,26/09/1963,1963-09-26,1963,9
27/09/1963,0.0,7.6,38.0,21.5,27/09/1963,1963-09-27,1963,9
28/09/1963,0.0,9.4,38.5,15.0,28/09/1963,1963-09-28,1963,9
29/09/1963,0.0,4.2,30.0,18.0,29/09/1963,1963-09-29,1963,9
30/09/1963,0.0,5.9,35.5,20.5,30/09/1963,1963-09-30,1963,9
01/10/1963,0.0,7.3,38.5,20.0,01/10/1963,1963-10-01,1963,10
02/10/1963,0.0,7.1,38.0,21.5,02/10/1963,1963-10-02,1963,10
03/10/1963,0.0,8.3,39.0,21.0,03/10/1963,1963-10-03,1963,10
04/10/1963,0.0,8.3,40.0,20.0,04/10/1963,1963-10-04,1963,10
05/10/1963,0.0,7.8,39.0,19.0,05/10/1963,1963-10-05,1963,10
06/10/1963,0.0,9.2,39.5,20.5,06/10/1963,1963-10-06,1963,10
07/10/1963,0.0,7.2,39.5,18.5,07/10/1963,1963-10-07,1963,10
08/10/1963,0.0,6.7,39.5,17.5,08/10/1963,1963-10-08,1963,10
09/10/1963,0.0,7.8,40.0,18.0,09/10/1963,1963-10-09,1963,10
10/10/1963,0.0,10.3,40.0,20.0,10/10/1963,1963-10-10,1963,10
11/10/1963,11.0,10.0,39.5,19.5,11/10/1963,1963-10-11,1963,10
12/10/1963,33.0,8.9,37.0,20.0,12/10/1963,1963-10-12,1963,10
13/10/1963,0.0,5.1,36.0,20.0,13/10/1963,1963-10-13,1963,10
14/10/1963,0.0,6.9,37.0,22.0,14/10/1963,1963-10-14,1963,10
15/10/1963,0.0,5.3,36.5,23.0,15/10/1963,1963-10-15,1963,10
16/10/1963,0.0,6.3,36.0,20.5,16/10/1963,1963-10-16,1963,10
17/10/1963,27.3,5.6,36.5,19.0,17/10/1963,1963-10-17,1963,10
18/10/1963,24.0,5.3,23.0,20.0,18/10/1963,1963-10-18,1963,10
19/10/1963,5.9,5.9,33.5,20.5,19/10/1963,1963-10-19,1963,10
20/10/1963,0.0,4.7,34.5,19.5,20/10/1963,1963-10-20,1963,10
21/10/1963,0.0,5.0,33.5,20.0,21/10/1963,1963-10-21,1963,10
22/10/1963,0.0,4.3,35.5,19.5,22/10/1963,1963-10-22,1963,10
23/10/1963,0.0,4.3,32.5,19.5,23/10/1963,1963-10-23,1963,10
24/10/1963,0.0,6.4,32.0,17.5,24/10/1963,1963-10-24,1963,10
25/10/1963,0.0,3.6,32.5,18.0,25/10/1963,1963-10-25,1963,10
26/10/1963,0.0,5.8,33.0,18.5,26/10/1963,1963-10-26,1963,10
27/10/1963,0.0,3.8,35.0,18.0,27/10/1963,1963-10-27,1963,10
28/10/1963,0.0,3.9,37.0,20.5,28/10/1963,1963-10-28,1963,10
29/10/1963,0.0,5.6,35.0,20.5,29/10/1963,1963-10-29,1963,10
30/10/1963,0.0,5.0,36.0,17.5,30/10/1963,1963-10-30,1963,10
31/10/1963,0.0,4.5,35.0,17.0,31/10/1963,1963-10-31,1963,10
01/11/1963,0.0,5.9,30.0,20.0,01/11/1963,1963-11-01,1963,11
02/11/1963,0.0,3.9,34.5,18.0,02/11/1963,1963-11-02,1963,11
03/11/1963,0.0,5.2,33.5,18.5,03/11/1963,1963-11-03,1963,11
04/11/1963,0.0,5.8,31.0,20.0,04/11/1963,1963-11-04,1963,11
05/11/1963,0.0,5.6,33.5,15.5,05/11/1963,1963-11-05,1963,11
06/11/1963,0.0,6.1,34.0,14.5,06/11/1963,1963-11-06,1963,11
07/11/1963,0.0,5.6,31.0,13.0,07/11/1963,1963-11-07,1963,11
08/11/1963,0.0,5.1,28.0,11.0,08/11/1963,1963-11-08,1963,11
09/11/1963,0.0,4.6,32.0,10.5,09/11/1963,1963-11-09,1963,11
10/11/1963,0.0,6.5,32.0,14.0,10/11/1963,1963-11-10,1963,11
11/11/1963,0.0,6.3,34.5,15.0,11/11/1963,1963-11-11,1963,11
12/11/1963,0.0,5.4,35.5,13.0,12/11/1963,1963-11-12,1963,11
13/11/1963,0.0,8.0,34.0,15.0,13/11/1963,1963-11-13,1963,11
14/11/1963,0.0,3.9,35.0,8.0,14/11/1963,1963-11-14,1963,11
15/11/1963,0.0,3.6,33.0,13.0,15/11/1963,1963-11-15,1963,11
16/11/1963,0.0,2.8,33.5,13.0,16/11/1963,1963-11-16,1963,11
17/11/1963,0.0,6.8,32.0,12.5,17/11/1963,1963-11-17,1963,11
18/11/1963,0.0,4.6,29.5,10.5,18/11/1963,1963-11-18,1963,11
19/11/1963,0.0,7.9,29.5,12.0,19/11/1963,1963-11-19,1963,11
20/11/1963,1.4,6.5,30.0,12.5,20/11/1963,1963-11-20,1963,11
21/11/1963,0.0,4.1,29.5,16.0,21/11/1963,1963-11-21,1963,11
22/11/1963,0.0,2.6,29.0,12.0,22/11/1963,1963-11-22,1963,11
23/11/1963,0.0,3.5,32.0,10.5,23/11/1963,1963-11-23,1963,11
24/11/1963,0.0,2.6,30.5,9.5,24/11/1963,1963-11-24,1963,11
25/11/1963,2.6,1.0,29.0,11.5,25/11/1963,1963-11-25,1963,11
26/11/1963,1.0,1.4,22.5,12.0,26/11/1963,1963-11-26,1963,11
27/11/1963,0.0,4.0,28.5,15.0,27/11/1963,1963-11-27,1963,11
28/11/1963,0.0,6.3,28.0,13.5,28/11/1963,1963-11-28,1963,11
29/11/1963,0.0,5.1,30.0,16.0,29/11/1963,1963-11-29,1963,11
30/11/1963,1.3,6.4,30.5,22.0,30/11/1963,1963-11-30,1963,11
01/02/1964,0.0,5.3,30.0,15.5,01/02/1964,1964-02-01,1964,2
02/02/1964,0.0,5.6,30.5,15.5,02/02/1964,1964-02-02,1964,2
03/02/1964,0.0,4.4,27.5,6.0,03/02/1964,1964-02-03,1964,2
04/02/1964,0.0,5.1,25.5,5.0,04/02/1964,1964-02-04,1964,2
05/02/1964,0.0,7.1,29.0,5.5,05/02/1964,1964-02-05,1964,2
06/02/1964,0.0,4.7,28.0,6.0,06/02/1964,1964-02-06,1964,2
07/02/1964,0.0,4.0,27.5,5.5,07/02/1964,1964-02-07,1964,2
08/02/1964,0.0,6.3,30.0,5.0,08/02/1964,1964-02-08,1964,2
09/02/1964,0.0,5.6,31.0,7.0,09/02/1964,1964-02-09,1964,2
10/02/1964,0.0,6.4,33.0,9.0,10/02/1964,1964-02-10,1964,2
11/02/1964,0.0,4.8,32.0,11.5,11/02/1964,1964-02-11,1964,2
12/02/1964,0.0,4.5,31.0,16.0,12/02/1964,1964-02-12,1964,2
13/02/1964,0.0,5.6,28.5,15.0,13/02/1964,1964-02-13,1964,2
14/02/1964,0.0,4.6,28.5,6.5,14/02/1964,1964-02-14,1964,2
15/02/1964,0.0,6.0,30.0,5.5,15/02/1964,1964-02-15,1964,2
16/02/1964,0.0,6.5,28.0,5.0,16/02/1964,1964-02-16,1964,2
17/02/1964,0.0,4.7,26.0,6.5,17/02/1964,1964-02-17,1964,2
18/02/1964,0.0,7.7,31.5,7.5,18/02/1964,1964-02-18,1964,2
19/02/1964,0.0,8.9,34.5,13.5,19/02/1964,1964-02-19,1964,2
20/02/1964,0.0,6.6,30.5,8.5,20/02/1964,1964-02-20,1964,2
21/02/1964,0.0,4.6,29.0,6.5,21/02/1964,1964-02-21,1964,2
22/02/1964,0.0,6.1,30.0,6.0,22/02/1964,1964-02-22,1964,2
23/02/1964,0.0,7.7,27.0,7.5,23/02/1964,1964-02-23,1964,2
24/02/1964,0.0,5.4,26.5,4.0,24/02/1964,1964-02-24,1964,2
25/02/1964,0.0,6.5,30.5,6.0,25/02/1964,1964-02-25,1964,2
26/02/1964,0.0,5.1,27.0,7.5,26/02/1964,1964-02-26,1964,2
27/02/1964,0.0,3.6,26.0,9.5,27/02/1964,1964-02-27,1964,2
28/02/1964,0.0,3.5,24.0,12.0,28/02/1964,1964-02-28,1964,2
29/02/1964,0.0,3.9,24.5,10.5,29/02/1964,1964-02-29,1964,2
01/03/1964,0.0,5.0,23.5,5.0,01/03/1964,1964-03-01,1964,3
02/03/1964,0.0,5.9,28.0,6.0,02/03/1964,1964-03-02,1964,3
03/03/1964,2.7,1.3,17.5,8.5,03/03/1964,1964-03-03,1964,3
04/03/1964,0.0,1.2,24.5,4.5,04/03/1964,1964-03-04,1964,3
05/03/1964,0.0,7.8,31.0,8.0,05/03/1964,1964-03-05,1964,3
06/03/1964,0.0,4.4,29.0,8.5,06/03/1964,1964-03-06,1964,3
07/03/1964,0.0,5.5,30.0,10.5,07/03/1964,1964-03-07,1964,3
08/03/1964,0.0,6.6,25.5,9.0,08/03/1964,1964-03-08,1964,3
09/03/1964,0.0,6.3,29.0,5.0,09/03/1964,1964-03-09,1964,3
10/03/1964,0.0,6.4,32.0,7.0,10/03/1964,1964-03-10,1964,3
11/03/1964,0.0,8.4,34.0,10.0,11/03/1964,1964-03-11,1964,3
12/03/1964,0.0,6.8,35.5,11.5,12/03/1964,1964-03-12,1964,3
13/03/1964,0.0,8.7,33.0,8.5,13/03/1964,1964-03-13,1964,3
14/03/1964,0.0,7.4,33.0,8.5,14/03/1964,1964-03-14,1964,3
15/03/1964,0.0,7.5,32.5,9.0,15/03/1964,1964-03-15,1964,3
16/03/1964,0.0,6.0,31.5,9.0,16/03/1964,1964-03-16,1964,3
17/03/1964,19.0,6.8,29.5,10.0,17/03/1964,1964-03-17,1964,3
18/03/1964,7.8,4.1,29.5,12.0,18/03/1964,1964-03-18,1964,3
19/03/1964,0.0,3.8,28.0,11.0,19/03/1964,1964-03-19,1964,3
20/03/1964,0.0,7.8,33.0,12.5,20/03/1964,1964-03-20,1964,3
21/03/1964,0.0,5.9,33.0,13.5,21/03/1964,1964-03-21,1964,3
22/03/1964,0.0,5.9,30.5,12.0,22/03/1964,1964-03-22,1964,3
23/03/1964,0.0,7.5,31.0,11.5,23/03/1964,1964-03-23,1964,3
24/03/1964,0.0,4.9,29.0,14.5,24/03/1964,1964-03-24,1964,3
25/03/1964,0.0,6.7,33.0,9.5,25/03/1964,1964-03-25,1964,3
26/03/1964,0.0,6.8,32.0,10.0,26/03/1964,1964-03-26,1964,3
27/03/1964,0.0,7.2,33.0,10.0,27/03/1964,1964-03-27,1964,3
28/03/1964,0.0,7.9,34.0,10.5,28/03/1964,1964-03-28,1964,3
29/03/1964,0.0,6.6,35.0,11.5,29/03/1964,1964-03-29,1964,3
30/03/1964,0.0,7.8,36.5,15.0,30/03/1964,1964-03-30,1964,3
31/03/1964,0.0,7.4,37.0,16.5,31/03/1964,1964-03-31,1964,3
01/04/1964,0.0,3.1,37.0,20.0,01/04/1964,1964-04-01,1964,4
02/04/1964,0.0,5.8,32.5,20.0,02/04/1964,1964-04-02,1964,4
03/04/1964,0.0,7.0,30.0,10.0,03/04/1964,1964-04-03,1964,4
04/04/1964,0.0,6.2,27.5,10.0,04/04/1964,1964-04-04,1964,4
05/04/1964,0.0,7.4,30.5,9.0,05/04/1964,1964-04-05,1964,4
06/04/1964,0.0,7.1,32.0,9.5,06/04/1964,1964-04-06,1964,4
07/04/1964,0.0,3.8,29.5,14.5,07/04/1964,1964-04-07,1964,4
08/04/1964,0.0,6.7,35.0,15.5,08/04/1964,1964-04-08,1964,4
09/04/1964,0.0,10.7,38.5,12.0,09/04/1964,1964-04-09,1964,4
10/04/1964,0.0,9.7,37.0,11.5,10/04/1964,1964-04-10,1964,4
11/04/1964,0.0,9.4,37.0,14.0,11/04/1964,1964-04-11,1964,4
12/04/1964,0.0,9.6,36.0,13.0,12/04/1964,1964-04-12,1964,4
13/04/1964,0.0,10.1,38.5,14.0,13/04/1964,1964-04-13,1964,4
14/04/1964,0.0,10.8,41.0,15.5,14/04/1964,1964-04-14,1964,4
15/04/1964,0.0,12.6,39.5,16.0,15/04/1964,1964-04-15,1964,4
16/04/1964,0.0,10.0,37.5,15.0,16/04/1964,1964-04-16,1964,4
17/04/1964,0.0,8.7,33.0,14.0,17/04/1964,1964-04-17,1964,4
18/04/1964,0.0,9.5,38.0,16.0,18/04/1964,1964-04-18,1964,4
19/04/1964,0.0,8.5,37.5,14.0,19/04/1964,1964-04-19,1964,4
20/04/1964,0.0,10.3,37.0,17.0,20/04/1964,1964-04-20,1964,4
21/04/1964,0.0,10.4,35.5,13.5,21/04/1964,1964-04-21,1964,4
22/04/1964,0.0,8.6,35.5,11.5,22/04/1964,1964-04-22,1964,4
23/04/1964,0.0,10.5,35.0,10.0,23/04/1964,1964-04-23,1964,4
24/04/1964,0.0,5.6,34.0,11.5,24/04/1964,1964-04-24,1964,4
25/04/1964,0.0,8.8,33.5,15.0,25/04/1964,1964-04-25,1964,4
26/04/1964,0.0,9.3,34.5,12.0,26/04/1964,1964-04-26,1964,4
27/04/1964,0.0,8.6,36.5,13.0,27/04/1964,1964-04-27,1964,4
28/04/1964,0.0,8.1,36.0,19.5,28/04/1964,1964-04-28,1964,4
29/04/1964,0.0,10.2,35.0,14.5,29/04/1964,1964-04-29,1964,4
30/04/1964,0.0,9.3,33.5,12.0,30/04/1964,1964-04-30,1964,4
01/05/1964,0.0,10.5,35.0,11.5,01/05/1964,1964-05-01,1964,5
02/05/1964,0.0,10.1,36.0,13.5,02/05/1964,1964-05-02,1964,5
03/05/1964,0.0,12.1,37.0,13.5,03/05/1964,1964-05-03,1964,5
04/05/1964,0.0,8.7,38.0,14.0,04/05/1964,1964-05-04,1964,5
05/05/1964,0.0,10.4,36.5,13.5,05/05/1964,1964-05-05,1964,5
06/05/1964,0.0,10.9,37.5,13.5,06/05/1964,1964-05-06,1964,5
07/05/1964,0.0,11.9,38.0,15.5,07/05/1964,1964-05-07,1964,5
08/05/1964,0.0,7.5,36.0,19.0,08/05/1964,1964-05-08,1964,5
09/05/1964,0.0,10.2,38.0,18.0,09/05/1964,1964-05-09,1964,5
10/05/1964,0.0,11.9,39.5,18.5,10/05/1964,1964-05-10,1964,5
11/05/1964,0.0,5.8,39.5,14.0,11/05/1964,1964-05-11,1964,5
12/05/1964,0.0,5.1,39.0,15.0,12/05/1964,1964-05-12,1964,5
13/05/1964,0.0,9.7,40.0,15.0,13/05/1964,1964-05-13,1964,5
14/05/1964,0.0,10.2,40.0,17.0,14/05/1964,1964-05-14,1964,5
15/05/1964,0.0,8.6,39.5,16.0,15/05/1964,1964-05-15,1964,5
16/05/1964,0.0,10.2,39.5,16.0,16/05/1964,1964-05-16,1964,5
17/05/1964,0.0,10.6,39.0,16.5,17/05/1964,1964-05-17,1964,5
18/05/1964,0.0,11.8,41.0,17.5,18/05/1964,1964-05-18,1964,5
19/05/1964,0.0,10.4,40.5,20.0,19/05/1964,1964-05-19,1964,5
20/05/1964,0.0,12.5,41.0,20.0,20/05/1964,1964-05-20,1964,5
21/05/1964,0.0,11.6,40.0,21.0,21/05/1964,1964-05-21,1964,5
22/05/1964,0.0,12.2,39.5,21.5,22/05/1964,1964-05-22,1964,5
23/05/1964,0.0,12.1,40.0,22.0,23/05/1964,1964-05-23,1964,5
24/05/1964,0.0,9.9,40.0,23.0,24/05/1964,1964-05-24,1964,5
25/05/1964,0.0,13.1,40.0,25.0,25/05/1964,1964-05-25,1964,5
26/05/1964,0.0,11.5,39.5,25.0,26/05/1964,1964-05-26,1964,5
27/05/1964,0.0,12.2,42.0,20.0,27/05/1964,1964-05-27,1964,5
28/05/1964,0.0,8.6,39.0,21.5,28/05/1964,1964-05-28,1964,5
29/05/1964,0.0,7.9,38.0,17.0,29/05/1964,1964-05-29,1964,5
30/05/1964,0.0,10.1,38.5,18.5,30/05/1964,1964-05-30,1964,5
31/05/1964,0.0,1.3,39.5,17.0,31/05/1964,1964-05-31,1964,5
01/06/1964,0.0,7.7,39.0,19.0,01/06/1964,1964-06-01,1964,6
02/06/1964,0.0,7.2,37.0,21.0,02/06/1964,1964-06-02,1964,6
03/06/1964,0.0,8.6,35.5,20.5,03/06/1964,1964-06-03,1964,6
04/06/1964,0.0,11.5,38.0,20.5,04/06/1964,1964-06-04,1964,6
05/06/1964,0.0,9.6,39.0,21.5,05/06/1964,1964-06-05,1964,6
06/06/1964,0.0,9.7,40.5,22.0,06/06/1964,1964-06-06,1964,6
07/06/1964,0.0,14.7,41.5,20.0,07/06/1964,1964-06-07,1964,6
08/06/1964,0.0,10.9,39.5,16.5,08/06/1964,1964-06-08,1964,6
09/06/1964,0.0,10.8,38.0,18.0,09/06/1964,1964-06-09,1964,6
10/06/1964,0.0,11.3,38.0,20.0,10/06/1964,1964-06-10,1964,6
11/06/1964,0.0,11.1,38.5,20.0,11/06/1964,1964-06-11,1964,6
12/06/1964,0.0,12.0,39.5,20.5,12/06/1964,1964-06-12,1964,6
13/06/1964,0.0,12.1,39.0,21.5,13/06/1964,1964-06-13,1964,6
14/06/1964,0.0,11.0,39.0,21.5,14/06/1964,1964-06-14,1964,6
15/06/1964,0.0,8.5,39.5,22.0,15/06/1964,1964-06-15,1964,6
16/06/1964,0.0,10.4,40.0,20.5,16/06/1964,1964-06-16,1964,6
17/06/1964,0.0,13.2,38.5,24.0,17/06/1964,1964-06-17,1964,6
18/06/1964,0.0,10.6,38.0,23.5,18/06/1964,1964-06-18,1964,6
19/06/1964,24.0,10.9,38.5,24.5,19/06/1964,1964-06-19,1964,6
20/06/1964,0.0,9.2,37.5,21.5,20/06/1964,1964-06-20,1964,6
21/06/1964,0.0,9.0,40.0,25.0,21/06/1964,1964-06-21,1964,6
22/06/1964,0.4,8.9,41.0,25.5,22/06/1964,1964-06-22,1964,6
23/06/1964,8.3,7.0,37.5,23.5,23/06/1964,1964-06-23,1964,6
24/06/1964,0.6,6.7,42.0,23.5,24/06/1964,1964-06-24,1964,6
25/06/1964,0.0,9.7,39.5,24.0,25/06/1964,1964-06-25,1964,6
26/06/1964,0.0,9.3,41.0,25.5,26/06/1964,1964-06-26,1964,6
27/06/1964,0.4,12.1,41.5,24.5,27/06/1964,1964-06-27,1964,6
28/06/1964,0.8,8.2,42.0,26.5,28/06/1964,1964-06-28,1964,6
29/06/1964,5.3,10.2,42.5,25.0,29/06/1964,1964-06-29,1964,6
30/06/1964,9.2,9.3,39.5,22.5,30/06/1964,1964-06-30,1964,6
01/07/1964,0.0,10.6,38.0,23.5,01/07/1964,1964-07-01,1964,7
02/07/1964,0.0,7.3,39.5,22.0,02/07/1964,1964-07-02,1964,7
03/07/1964,0.0,10.3,41.5,24.5,03/07/1964,1964-07-03,1964,7
04/07/1964,3.0,10.2,39.5,26.0,04/07/1964,1964-07-04,1964,7
05/07/1964,0.0,8.1,39.0,24.5,05/07/1964,1964-07-05,1964,7
06/07/1964,5.0,7.0,38.0,25.5,06/07/1964,1964-07-06,1964,7
07/07/1964,0.0,8.8,37.5,20.0,07/07/1964,1964-07-07,1964,7
08/07/1964,0.0,8.5,39.5,22.0,08/07/1964,1964-07-08,1964,7
09/07/1964,0.0,10.6,39.0,25.0,09/07/1964,1964-07-09,1964,7
10/07/1964,9.1,8.4,39.5,26.5,10/07/1964,1964-07-10,1964,7
11/07/1964,0.0,8.2,38.0,22.5,11/07/1964,1964-07-11,1964,7
12/07/1964,0.0,7.7,39.0,22.0,12/07/1964,1964-07-12,1964,7
13/07/1964,1.3,8.4,39.0,24.5,13/07/1964,1964-07-13,1964,7
14/07/1964,3.4,8.3,38.5,24.5,14/07/1964,1964-07-14,1964,7
15/07/1964,0.0,8.5,38.5,23.5,15/07/1964,1964-07-15,1964,7
16/07/1964,4.9,8.5,41.0,24.5,16/07/1964,1964-07-16,1964,7
17/07/1964,4.2,10.8,39.5,18.5,17/07/1964,1964-07-17,1964,7
18/07/1964,50.3,10.9,40.0,20.5,18/07/1964,1964-07-18,1964,7
19/07/1964,0.0,6.8,37.5,22.5,19/07/1964,1964-07-19,1964,7
20/07/1964,5.3,5.7,39.0,25.0,20/07/1964,1964-07-20,1964,7
21/07/1964,1.9,4.0,34.5,22.5,21/07/1964,1964-07-21,1964,7
22/07/1964,17.5,7.9,38.5,23.0,22/07/1964,1964-07-22,1964,7
23/07/1964,15.1,7.2,35.5,22.0,23/07/1964,1964-07-23,1964,7
24/07/1964,9.0,6.1,34.0,23.0,24/07/1964,1964-07-24,1964,7
25/07/1964,0.0,6.6,38.0,23.5,25/07/1964,1964-07-25,1964,7
26/07/1964,0.0,8.3,38.5,23.0,26/07/1964,1964-07-26,1964,7
27/07/1964,5.5,9.1,39.5,23.0,27/07/1964,1964-07-27,1964,7
28/07/1964,16.9,5.1,34.5,25.5,28/07/1964,1964-07-28,1964,7
29/07/1964,11.9,4.7,34.0,22.5,29/07/1964,1964-07-29,1964,7
30/07/1964,9.5,3.4,33.5,24.0,30/07/1964,1964-07-30,1964,7
31/07/1964,30.0,4.9,34.0,23.0,31/07/1964,1964-07-31,1964,7
01/08/1964,0.0,3.0,33.5,22.5,01/08/1964,1964-08-01,1964,8
02/08/1964,0.0,4.5,36.5,24.0,02/08/1964,1964-08-02,1964,8
03/08/1964,3.7,6.0,38.5,23.0,03/08/1964,1964-08-03,1964,8
04/08/1964,0.4,3.5,34.5,23.5,04/08/1964,1964-08-04,1964,8
05/08/1964,0.0,4.5,35.5,23.0,05/08/1964,1964-08-05,1964,8
06/08/1964,0.0,4.4,36.5,24.5,06/08/1964,1964-08-06,1964,8
07/08/1964,2.7,4.4,35.5,25.5,07/08/1964,1964-08-07,1964,8
08/08/1964,0.0,4.1,34.5,22.0,08/08/1964,1964-08-08,1964,8
09/08/1964,2.0,6.8,35.5,24.5,09/08/1964,1964-08-09,1964,8
10/08/1964,0.0,6.3,35.0,23.5,10/08/1964,1964-08-10,1964,8
11/08/1964,0.0,7.5,37.5,24.0,11/08/1964,1964-08-11,1964,8
12/08/1964,4.5,4.0,34.5,24.5,12/08/1964,1964-08-12,1964,8
13/08/1964,53.5,3.6,34.5,23.0,13/08/1964,1964-08-13,1964,8
14/08/1964,0.0,5.4,36.5,23.0,14/08/1964,1964-08-14,1964,8
15/08/1964,0.0,4.8,35.5,23.5,15/08/1964,1964-08-15,1964,8
16/08/1964,0.0,5.3,36.5,24.5,16/08/1964,1964-08-16,1964,8
17/08/1964,4.6,8.4,39.5,24.5,17/08/1964,1964-08-17,1964,8
18/08/1964,0.0,6.9,37.5,23.0,18/08/1964,1964-08-18,1964,8
19/08/1964,2.2,5.2,37.5,24.5,19/08/1964,1964-08-19,1964,8
20/08/1964,0.0,4.2,33.5,23.5,20/08/1964,1964-08-20,1964,8
21/08/1964,11.0,7.2,37.0,25.5,21/08/1964,1964-08-21,1964,8
22/08/1964,13.8,5.2,37.5,22.5,22/08/1964,1964-08-22,1964,8
23/08/1964,44.8,3.7,34.5,20.5,23/08/1964,1964-08-23,1964,8
24/08/1964,0.0,4.0,35.5,21.5,24/08/1964,1964-08-24,1964,8
25/08/1964,0.0,4.9,34.0,22.5,25/08/1964,1964-08-25,1964,8
26/08/1964,11.4,5.0,34.5,23.5,26/08/1964,1964-08-26,1964,8
27/08/1964,0.0,5.5,34.5,21.5,27/08/1964,1964-08-27,1964,8
28/08/1964,0.0,4.7,34.5,22.5,28/08/1964,1964-08-28,1964,8
29/08/1964,0.0,6.5,36.0,22.0,29/08/1964,1964-08-29,1964,8
30/08/1964,0.0,8.1,37.5,22.5,30/08/1964,1964-08-30,1964,8
31/08/1964,0.0,5.2,37.0,23.0,31/08/1964,1964-08-31,1964,8
01/09/1964,2.9,6.3,36.0,22.5,01/09/1964,1964-09-01,1964,9
02/09/1964,22.0,10.7,39.5,23.5,02/09/1964,1964-09-02,1964,9
03/09/1964,0.0,4.7,37.5,20.5,03/09/1964,1964-09-03,1964,9
04/09/1964,0.3,7.0,38.0,22.5,04/09/1964,1964-09-04,1964,9
05/09/1964,29.7,8.1,36.5,22.5,05/09/1964,1964-09-05,1964,9
06/09/1964,0.0,5.9,35.0,22.0,06/09/1964,1964-09-06,1964,9
07/09/1964,0.0,4.7,34.5,24.5,07/09/1964,1964-09-07,1964,9
08/09/1964,4.0,2.6,35.0,22.5,08/09/1964,1964-09-08,1964,9
09/09/1964,70.5,6.3,34.0,23.5,09/09/1964,1964-09-09,1964,9
10/09/1964,0.0,5.3,33.0,20.5,10/09/1964,1964-09-10,1964,9
11/09/1964,0.0,6.9,35.5,22.0,11/09/1964,1964-09-11,1964,9
12/09/1964,3.1,4.9,36.0,23.5,12/09/1964,1964-09-12,1964,9
13/09/1964,0.0,5.4,34.5,23.0,13/09/1964,1964-09-13,1964,9
14/09/1964,0.0,3.8,34.0,23.5,14/09/1964,1964-09-14,1964,9
15/09/1964,0.0,5.0,35.5,22.0,15/09/1964,1964-09-15,1964,9
16/09/1964,0.0,6.2,35.5,23.0,16/09/1964,1964-09-16,1964,9
17/09/1964,0.0,5.2,35.5,23.5,17/09/1964,1964-09-17,1964,9
18/09/1964,0.0,4.2,34.0,25.5,18/09/1964,1964-09-18,1964,9
19/09/1964,16.3,6.4,34.0,23.0,19/09/1964,1964-09-19,1964,9
20/09/1964,0.0,5.3,35.5,21.5,20/09/1964,1964-09-20,1964,9
21/09/1964,0.0,5.0,37.0,23.5,21/09/1964,1964-09-21,1964,9
22/09/1964,0.0,5.4,37.5,23.5,22/09/1964,1964-09-22,1964,9
23/09/1964,0.0,5.4,37.0,22.5,23/09/1964,1964-09-23,1964,9
24/09/1964,0.0,5.4,37.5,22.5,24/09/1964,1964-09-24,1964,9
25/09/1964,0.0,5.9,37.5,20.5,25/09/1964,1964-09-25,1964,9
26/09/1964,0.0,6.3,37.0,20.5,26/09/1964,1964-09-26,1964,9
27/09/1964,0.0,5.9,38.5,21.0,27/09/1964,1964-09-27,1964,9
28/09/1964,0.0,7.2,39.5,20.0,28/09/1964,1964-09-28,1964,9
29/09/1964,0.0,4.6,39.5,20.5,29/09/1964,1964-09-29,1964,9
30/09/1964,0.0,5.8,39.0,21.5,30/09/1964,1964-09-30,1964,9
01/10/1964,0.0,4.9,34.0,24.5,01/10/1964,1964-10-01,1964,10
02/10/1964,0.0,4.3,35.5,20.5,02/10/1964,1964-10-02,1964,10
03/10/1964,0.0,6.4,39.0,23.5,03/10/1964,1964-10-03,1964,10
04/10/1964,0.0,7.3,38.0,22.5,04/10/1964,1964-10-04,1964,10
05/10/1964,0.0,8.9,37.5,23.0,05/10/1964,1964-10-05,1964,10
06/10/1964,0.0,7.0,36.0,24.5,06/10/1964,1964-10-06,1964,10
07/10/1964,0.0,5.6,35.0,24.0,07/10/1964,1964-10-07,1964,10
08/10/1964,0.0,7.0,38.0,18.5,08/10/1964,1964-10-08,1964,10
09/10/1964,0.0,11.5,39.5,19.5,09/10/1964,1964-10-09,1964,10
10/10/1964,0.0,8.0,38.0,22.5,10/10/1964,1964-10-10,1964,10
11/10/1964,0.4,4.9,38.5,21.0,11/10/1964,1964-10-11,1964,10
12/10/1964,0.0,6.4,37.5,22.0,12/10/1964,1964-10-12,1964,10
13/10/1964,1.4,4.8,35.5,22.0,13/10/1964,1964-10-13,1964,10
14/10/1964,0.0,5.7,34.5,20.5,14/10/1964,1964-10-14,1964,10
15/10/1964,0.0,4.5,34.5,22.5,15/10/1964,1964-10-15,1964,10
16/10/1964,0.0,5.6,32.5,18.0,16/10/1964,1964-10-16,1964,10
17/10/1964,0.0,6.7,29.5,19.5,17/10/1964,1964-10-17,1964,10
18/10/1964,0.0,6.6,32.5,14.5,18/10/1964,1964-10-18,1964,10
19/10/1964,0.0,3.2,34.5,17.5,19/10/1964,1964-10-19,1964,10
20/10/1964,0.0,10.9,35.5,16.0,20/10/1964,1964-10-20,1964,10
21/10/1964,0.0,7.0,37.5,24.5,21/10/1964,1964-10-21,1964,10
22/10/1964,0.0,8.1,38.0,20.0,22/10/1964,1964-10-22,1964,10
23/10/1964,0.0,8.6,40.5,17.5,23/10/1964,1964-10-23,1964,10
24/10/1964,0.0,5.9,38.0,16.5,24/10/1964,1964-10-24,1964,10
25/10/1964,1.2,4.9,34.5,22.0,25/10/1964,1964-10-25,1964,10
26/10/1964,0.0,6.0,35.5,19.5,26/10/1964,1964-10-26,1964,10
27/10/1964,0.0,5.9,37.5,20.5,27/10/1964,1964-10-27,1964,10
28/10/1964,0.0,8.2,39.5,17.5,28/10/1964,1964-10-28,1964,10
29/10/1964,0.0,8.8,41.5,18.5,29/10/1964,1964-10-29,1964,10
30/10/1964,0.0,5.8,38.5,22.0,30/10/1964,1964-10-30,1964,10
31/10/1964,0.0,5.0,35.0,22.0,31/10/1964,1964-10-31,1964,10
01/11/1964,0.0,7.0,36.0,21.5,01/11/1964,1964-11-01,1964,11
02/11/1964,0.0,5.9,34.5,17.5,02/11/1964,1964-11-02,1964,11
03/11/1964,0.0,7.8,35.5,18.5,03/11/1964,1964-11-03,1964,11
04/11/1964,0.0,10.3,34.5,15.5,04/11/1964,1964-11-04,1964,11
05/11/1964,0.0,7.8,34.0,18.0,05/11/1964,1964-11-05,1964,11
06/11/1964,0.0,7.9,36.5,15.0,06/11/1964,1964-11-06,1964,11
07/11/1964,0.0,10.7,37.5,16.0,07/11/1964,1964-11-07,1964,11
08/11/1964,0.0,9.2,38.0,14.0,08/11/1964,1964-11-08,1964,11
09/11/1964,0.0,6.6,37.0,14.5,09/11/1964,1964-11-09,1964,11
10/11/1964,0.0,5.3,34.5,11.5,10/11/1964,1964-11-10,1964,11
11/11/1964,0.0,4.8,32.5,12.0,11/11/1964,1964-11-11,1964,11
12/11/1964,0.0,6.5,32.5,11.5,12/11/1964,1964-11-12,1964,11
13/11/1964,0.0,5.3,33.5,11.5,13/11/1964,1964-11-13,1964,11
14/11/1964,0.0,4.0,30.0,9.0,14/11/1964,1964-11-14,1964,11
15/11/1964,0.7,2.6,27.5,11.5,15/11/1964,1964-11-15,1964,11
16/11/1964,0.0,3.8,26.0,15.5,16/11/1964,1964-11-16,1964,11
17/11/1964,0.0,4.3,28.5,14.5,17/11/1964,1964-11-17,1964,11
18/11/1964,0.0,3.7,27.5,13.5,18/11/1964,1964-11-18,1964,11
19/11/1964,0.0,4.6,26.5,8.5,19/11/1964,1964-11-19,1964,11
20/11/1964,0.0,4.1,27.0,9.0,20/11/1964,1964-11-20,1964,11
21/11/1964,0.0,3.5,27.0,5.0,21/11/1964,1964-11-21,1964,11
22/11/1964,0.0,8.4,32.5,9.0,22/11/1964,1964-11-22,1964,11
23/11/1964,0.0,6.6,34.5,7.5,23/11/1964,1964-11-23,1964,11
24/11/1964,0.0,6.5,35.5,15.5,24/11/1964,1964-11-24,1964,11
25/11/1964,0.0,5.6,29.0,9.0,25/11/1964,1964-11-25,1964,11
26/11/1964,0.0,4.7,33.0,8.5,26/11/1964,1964-11-26,1964,11
27/11/1964,0.0,6.5,30.5,9.0,27/11/1964,1964-11-27,1964,11
28/11/1964,0.0,6.1,33.5,10.5,28/11/1964,1964-11-28,1964,11
29/11/1964,0.0,6.3,35.5,10.5,29/11/1964,1964-11-29,1964,11
30/11/1964,0.0,6.2,36.5,11.5,30/11/1964,1964-11-30,1964,11
01/12/1964,0.0,4.2,32.5,12.5,01/12/1964,1964-12-01,1964,12
02/12/1964,0.0,4.4,32.5,8.0,02/12/1964,1964-12-02,1964,12
03/12/1964,0.0,3.0,29.5,9.0,03/12/1964,1964-12-03,1964,12
04/12/1964,0.0,4.7,28.5,9.0,04/12/1964,1964-12-04,1964,12
05/12/1964,0.0,4.7,30.5,9.0,05/12/1964,1964-12-05,1964,12
06/12/1964,0.0,4.3,32.5,8.5,06/12/1964,1964-12-06,1964,12
07/12/1964,0.0,3.6,28.5,10.5,07/12/1964,1964-12-07,1964,12
08/12/1964,0.0,2.6,22.5,8.5,08/12/1964,1964-12-08,1964,12
09/12/1964,0.0,3.6,24.5,9.0,09/12/1964,1964-12-09,1964,12
10/12/1964,0.0,4.2,26.5,6.5,10/12/1964,1964-12-10,1964,12
11/12/1964,0.0,4.4,27.5,5.5,11/12/1964,1964-12-11,1964,12
12/12/1964,0.0,4.8,31.5,6.5,12/12/1964,1964-12-12,1964,12
13/12/1964,0.0,11.0,30.5,9.0,13/12/1964,1964-12-13,1964,12
14/12/1964,0.0,10.6,30.5,19.0,14/12/1964,1964-12-14,1964,12
15/12/1964,17.9,5.3,26.5,14.5,15/12/1964,1964-12-15,1964,12
16/12/1964,26.2,2.0,29.0,15.0,16/12/1964,1964-12-16,1964,12
17/12/1964,0.0,2.0,24.5,15.5,17/12/1964,1964-12-17,1964,12
18/12/1964,0.0,5.8,32.0,8.5,18/12/1964,1964-12-18,1964,12
19/12/1964,0.0,3.1,32.5,16.0,19/12/1964,1964-12-19,1964,12
20/12/1964,0.0,5.0,32.5,14.5,20/12/1964,1964-12-20,1964,12
21/12/1964,0.0,6.3,32.0,16.5,21/12/1964,1964-12-21,1964,12
22/12/1964,0.0,6.8,35.0,15.5,22/12/1964,1964-12-22,1964,12
23/12/1964,0.0,4.6,32.5,13.5,23/12/1964,1964-12-23,1964,12
24/12/1964,0.0,4.5,31.0,13.5,24/12/1964,1964-12-24,1964,12
25/12/1964,0.0,3.3,29.5,13.0,25/12/1964,1964-12-25,1964,12
26/12/1964,0.0,4.7,28.5,12.5,26/12/1964,1964-12-26,1964,12
27/12/1964,0.0,2.1,29.0,11.5,27/12/1964,1964-12-27,1964,12
28/12/1964,0.0,3.6,29.5,11.0,28/12/1964,1964-12-28,1964,12
29/12/1964,0.0,4.5,30.5,11.5,29/12/1964,1964-12-29,1964,12
30/12/1964,0.0,3.0,30.5,9.0,30/12/1964,1964-12-30,1964,12
31/12/1964,0.0,3.1,26.5,10.5,31/12/1964,1964-12-31,1964,12
01/01/1965,0.0,2.1,25.5,11.0,01/01/1965,1965-01-01,1965,1
02/01/1965,0.0,3.3,27.0,11.5,02/01/1965,1965-01-02,1965,1
03/01/1965,0.0,4.5,31.0,15.0,03/01/1965,1965-01-03,1965,1
04/01/1965,0.0,2.1,31.0,11.0,04/01/1965,1965-01-04,1965,1
05/01/1965,0.0,6.6,31.5,10.5,05/01/1965,1965-01-05,1965,1
06/01/1965,0.0,4.8,26.0,11.5,06/01/1965,1965-01-06,1965,1
07/01/1965,3.6,1.5,22.5,12.0,07/01/1965,1965-01-07,1965,1
08/01/1965,0.0,2.3,28.0,14.5,08/01/1965,1965-01-08,1965,1
09/01/1965,0.0,2.9,31.0,15.5,09/01/1965,1965-01-09,1965,1
10/01/1965,0.0,5.1,31.5,12.0,10/01/1965,1965-01-10,1965,1
11/01/1965,0.0,4.1,25.0,10.0,11/01/1965,1965-01-11,1965,1
12/01/1965,0.0,4.3,28.5,10.5,12/01/1965,1965-01-12,1965,1
13/01/1965,0.0,5.7,32.0,11.0,13/01/1965,1965-01-13,1965,1
14/01/1965,0.0,6.3,33.0,15.5,14/01/1965,1965-01-14,1965,1
15/01/1965,0.0,4.1,26.5,14.0,15/01/1965,1965-01-15,1965,1
16/01/1965,0.0,11.6,30.0,16.0,16/01/1965,1965-01-16,1965,1
17/01/1965,0.0,10.9,33.0,18.0,17/01/1965,1965-01-17,1965,1
18/01/1965,0.0,6.6,34.0,18.5,18/01/1965,1965-01-18,1965,1
19/01/1965,0.0,4.9,32.0,17.0,19/01/1965,1965-01-19,1965,1
20/01/1965,0.0,4.2,24.0,15.5,20/01/1965,1965-01-20,1965,1
21/01/1965,0.0,4.6,24.5,15.0,21/01/1965,1965-01-21,1965,1
22/01/1965,0.0,4.4,24.0,12.5,22/01/1965,1965-01-22,1965,1
23/01/1965,0.0,4.2,28.5,10.5,23/01/1965,1965-01-23,1965,1
24/01/1965,0.0,4.1,29.0,9.5,24/01/1965,1965-01-24,1965,1
25/01/1965,0.0,5.7,28.0,9.0,25/01/1965,1965-01-25,1965,1
26/01/1965,0.0,6.2,30.0,9.0,26/01/1965,1965-01-26,1965,1
27/01/1965,0.0,7.9,29.5,10.0,27/01/1965,1965-01-27,1965,1
28/01/1965,0.0,10.9,31.5,9.0,28/01/1965,1965-01-28,1965,1
29/01/1965,0.0,8.2,31.5,14.0,29/01/1965,1965-01-29,1965,1
30/01/1965,0.0,5.8,31.5,10.5,30/01/1965,1965-01-30,1965,1
31/01/1965,0.0,6.6,32.0,12.0,31/01/1965,1965-01-31,1965,1
01/02/1965,0.0,5.8,28.5,9.5,01/02/1965,1965-02-01,1965,2
02/02/1965,19.8,4.4,23.0,14.0,02/02/1965,1965-02-02,1965,2
03/02/1965,7.5,3.4,22.5,14.0,03/02/1965,1965-02-03,1965,2
04/02/1965,0.0,3.0,27.0,11.0,04/02/1965,1965-02-04,1965,2
05/02/1965,0.0,3.9,28.0,10.5,05/02/1965,1965-02-05,1965,2
06/02/1965,4.8,4.7,26.5,10.5,06/02/1965,1965-02-06,1965,2
07/02/1965,35.2,2.9,21.0,12.5,07/02/1965,1965-02-07,1965,2
08/02/1965,3.6,1.5,18.0,13.0,08/02/1965,1965-02-08,1965,2
09/02/1965,0.0,3.1,23.5,8.0,09/02/1965,1965-02-09,1965,2
10/02/1965,0.0,4.6,24.0,9.0,10/02/1965,1965-02-10,1965,2
11/02/1965,0.0,2.4,25.0,9.0,11/02/1965,1965-02-11,1965,2
12/02/1965,0.0,5.9,26.5,5.5,12/02/1965,1965-02-12,1965,2
13/02/1965,0.0,4.9,26.0,2.0,13/02/1965,1965-02-13,1965,2
14/02/1965,0.0,6.5,27.5,3.5,14/02/1965,1965-02-14,1965,2
15/02/1965,0.0,4.6,24.0,4.5,15/02/1965,1965-02-15,1965,2
16/02/1965,0.0,5.2,25.0,5.5,16/02/1965,1965-02-16,1965,2
17/02/1965,0.0,5.6,26.5,7.0,17/02/1965,1965-02-17,1965,2
18/02/1965,0.0,11.9,29.5,9.0,18/02/1965,1965-02-18,1965,2
19/02/1965,0.0,5.7,29.5,10.0,19/02/1965,1965-02-19,1965,2
20/02/1965,0.0,9.1,32.0,14.0,20/02/1965,1965-02-20,1965,2
21/02/1965,0.0,6.2,33.0,11.0,21/02/1965,1965-02-21,1965,2
22/02/1965,0.0,7.3,31.5,9.0,22/02/1965,1965-02-22,1965,2
23/02/1965,0.0,5.8,27.5,7.5,23/02/1965,1965-02-23,1965,2
24/02/1965,0.0,7.1,31.5,9.5,24/02/1965,1965-02-24,1965,2
25/02/1965,0.0,3.9,34.5,13.0,25/02/1965,1965-02-25,1965,2
26/02/1965,0.0,4.4,34.5,12.5,26/02/1965,1965-02-26,1965,2
27/02/1965,0.0,6.3,33.0,11.0,27/02/1965,1965-02-27,1965,2
28/02/1965,0.0,5.9,31.0,10.0,28/02/1965,1965-02-28,1965,2
01/03/1965,0.0,6.3,29.5,10.0,01/03/1965,1965-03-01,1965,3
02/03/1965,0.0,6.4,27.5,10.0,02/03/1965,1965-03-02,1965,3
03/03/1965,0.0,6.8,26.5,5.0,03/03/1965,1965-03-03,1965,3
04/03/1965,0.0,5.8,30.0,5.0,04/03/1965,1965-03-04,1965,3
05/03/1965,0.0,7.2,31.5,5.0,05/03/1965,1965-03-05,1965,3
06/03/1965,0.0,8.3,34.5,7.5,06/03/1965,1965-03-06,1965,3
07/03/1965,0.0,6.2,33.0,8.5,07/03/1965,1965-03-07,1965,3
08/03/1965,0.0,6.2,33.5,8.5,08/03/1965,1965-03-08,1965,3
09/03/1965,0.0,7.1,35.0,9.0,09/03/1965,1965-03-09,1965,3
10/03/1965,5.9,4.1,30.5,14.0,10/03/1965,1965-03-10,1965,3
11/03/1965,2.2,1.3,22.5,14.5,11/03/1965,1965-03-11,1965,3
12/03/1965,0.0,5.1,28.0,12.5,12/03/1965,1965-03-12,1965,3
13/03/1965,0.0,5.0,31.0,13.0,13/03/1965,1965-03-13,1965,3
14/03/1965,0.0,7.3,31.5,10.0,14/03/1965,1965-03-14,1965,3
15/03/1965,0.0,6.0,32.5,9.0,15/03/1965,1965-03-15,1965,3
16/03/1965,0.0,7.3,33.5,9.5,16/03/1965,1965-03-16,1965,3
17/03/1965,0.0,7.7,32.0,7.5,17/03/1965,1965-03-17,1965,3
18/03/1965,0.0,6.1,32.0,9.0,18/03/1965,1965-03-18,1965,3
19/03/1965,0.0,8.1,33.5,9.5,19/03/1965,1965-03-19,1965,3
20/03/1965,0.0,8.1,34.0,10.5,20/03/1965,1965-03-20,1965,3
21/03/1965,0.0,8.0,34.5,12.5,21/03/1965,1965-03-21,1965,3
22/03/1965,0.0,4.6,32.0,11.0,22/03/1965,1965-03-22,1965,3
23/03/1965,0.0,6.5,33.5,13.0,23/03/1965,1965-03-23,1965,3
24/03/1965,0.0,8.1,33.0,12.5,24/03/1965,1965-03-24,1965,3
25/03/1965,0.0,8.0,32.5,12.5,25/03/1965,1965-03-25,1965,3
26/03/1965,0.0,8.8,34.5,10.5,26/03/1965,1965-03-26,1965,3
27/03/1965,0.0,8.6,34.5,12.0,27/03/1965,1965-03-27,1965,3
28/03/1965,0.0,6.7,29.5,11.0,28/03/1965,1965-03-28,1965,3
29/03/1965,0.0,6.8,31.5,13.0,29/03/1965,1965-03-29,1965,3
30/03/1965,0.0,5.4,32.0,13.0,30/03/1965,1965-03-30,1965,3
31/03/1965,0.0,9.1,33.5,14.0,31/03/1965,1965-03-31,1965,3
01/04/1965,0.0,5.1,28.0,15.0,01/04/1965,1965-04-01,1965,4
02/04/1965,0.0,4.1,28.0,16.0,02/04/1965,1965-04-02,1965,4
03/04/1965,0.0,7.7,33.0,14.0,03/04/1965,1965-04-03,1965,4
04/04/1965,0.0,6.3,31.5,14.0,04/04/1965,1965-04-04,1965,4
05/04/1965,0.0,7.1,30.0,15.0,05/04/1965,1965-04-05,1965,4
06/04/1965,0.0,6.5,31.5,12.5,06/04/1965,1965-04-06,1965,4
07/04/1965,0.0,8.1,32.0,13.0,07/04/1965,1965-04-07,1965,4
08/04/1965,0.0,4.6,28.5,12.0,08/04/1965,1965-04-08,1965,4
09/04/1965,0.0,6.6,31.0,14.5,09/04/1965,1965-04-09,1965,4
10/04/1965,0.0,7.8,34.5,11.0,10/04/1965,1965-04-10,1965,4
11/04/1965,0.0,8.1,33.0,10.5,11/04/1965,1965-04-11,1965,4
12/04/1965,0.0,8.6,33.0,11.5,12/04/1965,1965-04-12,1965,4
13/04/1965,0.0,8.3,32.0,14.0,13/04/1965,1965-04-13,1965,4
14/04/1965,0.0,9.8,34.5,14.5,14/04/1965,1965-04-14,1965,4
15/04/1965,0.0,9.3,36.5,12.5,15/04/1965,1965-04-15,1965,4
16/04/1965,0.0,8.6,37.5,14.0,16/04/1965,1965-04-16,1965,4
17/04/1965,0.0,11.9,36.5,14.0,17/04/1965,1965-04-17,1965,4
18/04/1965,0.0,8.1,38.5,13.5,18/04/1965,1965-04-18,1965,4
19/04/1965,0.0,10.4,42.0,14.5,19/04/1965,1965-04-19,1965,4
20/04/1965,0.0,12.6,43.0,19.0,20/04/1965,1965-04-20,1965,4
21/04/1965,0.0,12.8,43.0,18.0,21/04/1965,1965-04-21,1965,4
22/04/1965,0.0,10.9,40.5,19.0,22/04/1965,1965-04-22,1965,4
23/04/1965,0.0,12.9,40.5,19.5,23/04/1965,1965-04-23,1965,4
24/04/1965,0.0,11.6,38.5,18.5,24/04/1965,1965-04-24,1965,4
25/04/1965,0.0,9.5,36.0,14.5,25/04/1965,1965-04-25,1965,4
26/04/1965,0.0,10.9,36.5,16.5,26/04/1965,1965-04-26,1965,4
27/04/1965,0.0,11.0,38.0,16.0,27/04/1965,1965-04-27,1965,4
28/04/1965,0.0,10.1,40.0,18.5,28/04/1965,1965-04-28,1965,4
29/04/1965,0.0,10.1,40.0,18.5,29/04/1965,1965-04-29,1965,4
30/04/1965,0.0,15.0,41.5,22.0,30/04/1965,1965-04-30,1965,4
01/05/1965,0.0,12.3,40.5,26.5,01/05/1965,1965-05-01,1965,5
02/05/1965,0.0,9.9,41.5,25.0,02/05/1965,1965-05-02,1965,5
03/05/1965,0.0,12.6,39.0,27.0,03/05/1965,1965-05-03,1965,5
04/05/1965,0.0,9.5,35.0,17.0,04/05/1965,1965-05-04,1965,5
05/05/1965,0.0,11.3,37.0,17.0,05/05/1965,1965-05-05,1965,5
06/05/1965,0.0,10.2,36.0,15.5,06/05/1965,1965-05-06,1965,5
07/05/1965,0.0,10.0,35.0,14.0,07/05/1965,1965-05-07,1965,5
08/05/1965,0.0,9.5,36.5,15.5,08/05/1965,1965-05-08,1965,5
09/05/1965,0.0,10.5,36.0,15.5,09/05/1965,1965-05-09,1965,5
10/05/1965,0.0,10.6,36.5,14.5,10/05/1965,1965-05-10,1965,5
11/05/1965,0.0,12.5,39.0,14.5,11/05/1965,1965-05-11,1965,5
12/05/1965,0.0,7.5,35.5,17.0,12/05/1965,1965-05-12,1965,5
13/05/1965,0.0,9.4,36.0,17.5,13/05/1965,1965-05-13,1965,5
14/05/1965,0.0,10.3,36.0,15.5,14/05/1965,1965-05-14,1965,5
15/05/1965,0.0,10.8,34.0,16.5,15/05/1965,1965-05-15,1965,5
16/05/1965,0.0,10.6,35.0,15.5,16/05/1965,1965-05-16,1965,5
17/05/1965,0.0,11.2,36.0,15.5,17/05/1965,1965-05-17,1965,5
18/05/1965,0.0,11.6,39.5,17.0,18/05/1965,1965-05-18,1965,5
19/05/1965,0.0,12.6,40.0,19.0,19/05/1965,1965-05-19,1965,5
20/05/1965,0.0,11.5,41.5,19.5,20/05/1965,1965-05-20,1965,5
21/05/1965,0.0,10.7,40.0,20.0,21/05/1965,1965-05-21,1965,5
22/05/1965,0.0,12.0,39.5,21.5,22/05/1965,1965-05-22,1965,5
23/05/1965,0.0,12.0,39.5,17.0,23/05/1965,1965-05-23,1965,5
24/05/1965,0.0,11.4,38.5,16.0,24/05/1965,1965-05-24,1965,5
25/05/1965,0.0,10.6,38.0,16.5,25/05/1965,1965-05-25,1965,5
26/05/1965,0.0,8.2,39.0,16.5,26/05/1965,1965-05-26,1965,5
27/05/1965,0.0,9.9,39.5,16.5,27/05/1965,1965-05-27,1965,5
28/05/1965,0.0,12.1,42.5,17.5,28/05/1965,1965-05-28,1965,5
29/05/1965,0.0,13.2,40.0,19.5,29/05/1965,1965-05-29,1965,5
30/05/1965,0.0,12.9,40.5,18.5,30/05/1965,1965-05-30,1965,5
31/05/1965,0.0,12.9,39.0,16.5,31/05/1965,1965-05-31,1965,5
01/06/1965,0.0,13.2,40.0,18.0,01/06/1965,1965-06-01,1965,6
02/06/1965,0.0,12.7,40.5,18.0,02/06/1965,1965-06-02,1965,6
03/06/1965,0.0,14.4,41.0,17.5,03/06/1965,1965-06-03,1965,6
04/06/1965,0.0,12.5,38.5,17.0,04/06/1965,1965-06-04,1965,6
05/06/1965,0.0,11.3,39.0,16.5,05/06/1965,1965-06-05,1965,6
06/06/1965,0.0,12.1,42.5,16.5,06/06/1965,1965-06-06,1965,6
07/06/1965,0.0,11.8,41.5,18.5,07/06/1965,1965-06-07,1965,6
08/06/1965,0.0,10.9,41.5,19.5,08/06/1965,1965-06-08,1965,6
09/06/1965,0.0,13.2,40.0,19.0,09/06/1965,1965-06-09,1965,6
10/06/1965,0.0,11.1,39.0,22.0,10/06/1965,1965-06-10,1965,6
11/06/1965,0.0,12.6,40.0,22.0,11/06/1965,1965-06-11,1965,6
12/06/1965,0.0,12.4,40.5,22.0,12/06/1965,1965-06-12,1965,6
13/06/1965,0.0,13.2,39.5,20.5,13/06/1965,1965-06-13,1965,6
14/06/1965,0.0,10.9,39.5,22.0,14/06/1965,1965-06-14,1965,6
15/06/1965,0.0,9.8,37.5,22.0,15/06/1965,1965-06-15,1965,6
16/06/1965,0.0,10.8,38.5,23.0,16/06/1965,1965-06-16,1965,6
17/06/1965,0.0,11.4,39.0,22.0,17/06/1965,1965-06-17,1965,6
18/06/1965,0.0,11.1,39.5,22.5,18/06/1965,1965-06-18,1965,6
19/06/1965,0.0,12.1,38.5,23.5,19/06/1965,1965-06-19,1965,6
20/06/1965,0.0,11.3,39.5,25.5,20/06/1965,1965-06-20,1965,6
21/06/1965,0.0,12.6,41.5,24.5,21/06/1965,1965-06-21,1965,6
22/06/1965,0.0,10.5,41.5,25.5,22/06/1965,1965-06-22,1965,6
23/06/1965,0.0,12.8,42.0,27.5,23/06/1965,1965-06-23,1965,6
24/06/1965,0.0,11.5,40.5,26.5,24/06/1965,1965-06-24,1965,6
25/06/1965,0.0,12.9,41.0,27.5,25/06/1965,1965-06-25,1965,6
26/06/1965,0.0,11.4,41.5,28.0,26/06/1965,1965-06-26,1965,6
27/06/1965,0.0,12.1,42.5,25.5,27/06/1965,1965-06-27,1965,6
28/06/1965,0.0,13.2,42.5,28.0,28/06/1965,1965-06-28,1965,6
29/06/1965,37.0,14.4,43.0,28.5,29/06/1965,1965-06-29,1965,6
30/06/1965,0.0,10.1,38.5,23.0,30/06/1965,1965-06-30,1965,6
01/07/1965,0.0,10.1,39.5,24.5,01/07/1965,1965-07-01,1965,7
02/07/1965,0.0,10.6,41.0,25.0,02/07/1965,1965-07-02,1965,7
03/07/1965,0.0,10.6,40.5,25.5,03/07/1965,1965-07-03,1965,7
04/07/1965,0.0,9.6,41.5,25.5,04/07/1965,1965-07-04,1965,7
05/07/1965,0.0,10.9,41.5,27.0,05/07/1965,1965-07-05,1965,7
06/07/1965,0.0,9.7,38.5,27.5,06/07/1965,1965-07-06,1965,7
07/07/1965,5.5,6.0,32.5,26.5,07/07/1965,1965-07-07,1965,7
08/07/1965,3.2,6.1,38.5,24.0,08/07/1965,1965-07-08,1965,7
09/07/1965,0.0,4.6,36.5,23.5,09/07/1965,1965-07-09,1965,7
10/07/1965,88.3,7.3,34.5,26.5,10/07/1965,1965-07-10,1965,7
11/07/1965,0.0,6.7,39.5,22.5,11/07/1965,1965-07-11,1965,7
12/07/1965,0.0,7.8,37.5,25.0,12/07/1965,1965-07-12,1965,7
13/07/1965,0.0,7.4,38.5,25.0,13/07/1965,1965-07-13,1965,7
14/07/1965,1.8,6.7,39.5,22.0,14/07/1965,1965-07-14,1965,7
15/07/1965,0.0,7.9,39.5,23.5,15/07/1965,1965-07-15,1965,7
16/07/1965,0.0,6.3,37.5,24.5,16/07/1965,1965-07-16,1965,7
17/07/1965,0.6,12.1,40.5,24.5,17/07/1965,1965-07-17,1965,7
18/07/1965,0.0,13.2,43.0,25.0,18/07/1965,1965-07-18,1965,7
19/07/1965,26.0,5.8,39.0,27.5,19/07/1965,1965-07-19,1965,7
20/07/1965,20.0,11.7,37.5,24.5,20/07/1965,1965-07-20,1965,7
21/07/1965,0.0,6.6,35.5,22.5,21/07/1965,1965-07-21,1965,7
22/07/1965,0.0,5.5,39.5,24.5,22/07/1965,1965-07-22,1965,7
23/07/1965,2.8,9.5,38.0,24.5,23/07/1965,1965-07-23,1965,7
24/07/1965,15.4,6.4,39.5,24.5,24/07/1965,1965-07-24,1965,7
25/07/1965,0.0,5.4,36.5,22.5,25/07/1965,1965-07-25,1965,7
26/07/1965,11.5,6.5,37.5,24.0,26/07/1965,1965-07-26,1965,7
27/07/1965,6.4,9.6,39.5,22.5,27/07/1965,1965-07-27,1965,7
28/07/1965,0.0,4.4,35.5,23.5,28/07/1965,1965-07-28,1965,7
29/07/1965,0.9,8.6,39.5,23.5,29/07/1965,1965-07-29,1965,7
30/07/1965,0.0,6.2,39.0,23.5,30/07/1965,1965-07-30,1965,7
31/07/1965,0.2,6.3,38.0,24.0,31/07/1965,1965-07-31,1965,7
01/08/1965,0.0,4.3,37.5,25.5,01/08/1965,1965-08-01,1965,8
02/08/1965,4.5,4.2,36.5,26.5,02/08/1965,1965-08-02,1965,8
03/08/1965,1.0,4.6,36.0,23.5,03/08/1965,1965-08-03,1965,8
04/08/1965,16.5,5.9,37.5,23.5,04/08/1965,1965-08-04,1965,8
05/08/1965,0.0,5.5,36.5,23.5,05/08/1965,1965-08-05,1965,8
06/08/1965,33.5,8.7,38.0,24.0,06/08/1965,1965-08-06,1965,8
07/08/1965,0.3,6.0,35.5,23.5,07/08/1965,1965-08-07,1965,8
08/08/1965,0.0,5.3,34.5,25.5,08/08/1965,1965-08-08,1965,8
09/08/1965,4.2,5.1,36.5,25.5,09/08/1965,1965-08-09,1965,8
10/08/1965,16.5,6.7,35.5,23.0,10/08/1965,1965-08-10,1965,8
11/08/1965,1.4,5.2,35.0,22.0,11/08/1965,1965-08-11,1965,8
12/08/1965,0.0,4.5,36.5,22.0,12/08/1965,1965-08-12,1965,8
13/08/1965,0.0,6.5,34.5,21.5,13/08/1965,1965-08-13,1965,8
14/08/1965,0.0,7.2,38.0,23.5,14/08/1965,1965-08-14,1965,8
15/08/1965,0.0,5.2,37.5,23.5,15/08/1965,1965-08-15,1965,8
16/08/1965,0.0,4.1,37.5,22.0,16/08/1965,1965-08-16,1965,8
17/08/1965,8.5,5.9,36.5,22.5,17/08/1965,1965-08-17,1965,8
18/08/1965,0.0,4.2,34.0,22.5,18/08/1965,1965-08-18,1965,8
19/08/1965,0.0,5.9,36.5,22.5,19/08/1965,1965-08-19,1965,8
20/08/1965,36.3,5.7,36.5,23.0,20/08/1965,1965-08-20,1965,8
21/08/1965,8.2,5.2,32.5,22.0,21/08/1965,1965-08-21,1965,8
22/08/1965,50.4,5.6,36.5,22.5,22/08/1965,1965-08-22,1965,8
23/08/1965,0.0,5.9,34.5,23.0,23/08/1965,1965-08-23,1965,8
24/08/1965,0.0,5.8,35.5,23.5,24/08/1965,1965-08-24,1965,8
25/08/1965,0.0,7.7,37.5,24.5,25/08/1965,1965-08-25,1965,8
26/08/1965,0.0,6.3,37.5,24.5,26/08/1965,1965-08-26,1965,8
27/08/1965,0.0,5.4,36.5,22.5,27/08/1965,1965-08-27,1965,8
28/08/1965,4.8,6.6,37.5,25.5,28/08/1965,1965-08-28,1965,8
29/08/1965,11.8,5.8,35.0,22.5,29/08/1965,1965-08-29,1965,8
30/08/1965,22.4,5.4,34.5,22.0,30/08/1965,1965-08-30,1965,8
31/08/1965,1.2,5.4,34.5,22.0,31/08/1965,1965-08-31,1965,8
01/09/1965,8.2,4.4,37.0,24.0,01/09/1965,1965-09-01,1965,9
02/09/1965,3.4,6.3,33.5,24.5,02/09/1965,1965-09-02,1965,9
03/09/1965,0.0,5.6,34.5,22.0,03/09/1965,1965-09-03,1965,9
04/09/1965,0.0,4.9,34.5,22.5,04/09/1965,1965-09-04,1965,9
05/09/1965,0.0,5.9,37.0,24.0,05/09/1965,1965-09-05,1965,9
06/09/1965,0.7,7.2,35.5,22.0,06/09/1965,1965-09-06,1965,9
07/09/1965,0.0,4.6,37.5,23.5,07/09/1965,1965-09-07,1965,9
08/09/1965,0.0,5.1,36.0,26.0,08/09/1965,1965-09-08,1965,9
09/09/1965,11.1,4.6,36.0,23.5,09/09/1965,1965-09-09,1965,9
10/09/1965,0.9,5.8,34.5,23.5,10/09/1965,1965-09-10,1965,9
11/09/1965,2.5,6.2,36.0,24.0,11/09/1965,1965-09-11,1965,9
12/09/1965,1.6,4.2,35.0,23.0,12/09/1965,1965-09-12,1965,9
13/09/1965,0.0,5.1,36.5,23.0,13/09/1965,1965-09-13,1965,9
14/09/1965,17.5,7.2,38.5,23.5,14/09/1965,1965-09-14,1965,9
15/09/1965,0.0,7.2,37.5,22.5,15/09/1965,1965-09-15,1965,9
16/09/1965,0.8,3.8,34.0,23.5,16/09/1965,1965-09-16,1965,9
17/09/1965,0.0,4.4,35.0,22.0,17/09/1965,1965-09-17,1965,9
18/09/1965,0.0,6.1,35.0,22.0,18/09/1965,1965-09-18,1965,9
19/09/1965,0.0,6.0,37.0,21.0,19/09/1965,1965-09-19,1965,9
20/09/1965,0.0,4.9,35.0,21.0,20/09/1965,1965-09-20,1965,9
21/09/1965,0.0,7.8,38.0,22.5,21/09/1965,1965-09-21,1965,9
22/09/1965,0.0,7.7,37.0,20.0,22/09/1965,1965-09-22,1965,9
23/09/1965,0.0,5.8,37.5,20.0,23/09/1965,1965-09-23,1965,9
24/09/1965,1.7,6.2,35.5,21.5,24/09/1965,1965-09-24,1965,9
25/09/1965,0.0,4.4,35.0,22.5,25/09/1965,1965-09-25,1965,9
26/09/1965,15.0,8.5,39.0,20.5,26/09/1965,1965-09-26,1965,9
27/09/1965,0.0,4.4,33.5,22.5,27/09/1965,1965-09-27,1965,9
28/09/1965,0.0,4.2,34.0,24.5,28/09/1965,1965-09-28,1965,9
29/09/1965,0.0,5.2,36.0,24.0,29/09/1965,1965-09-29,1965,9
30/09/1965,0.0,5.7,35.5,22.5,30/09/1965,1965-09-30,1965,9
01/10/1965,0.0,13.6,36.5,19.5,01/10/1965,1965-10-01,1965,10
02/10/1965,0.0,8.9,37.5,25.5,02/10/1965,1965-10-02,1965,10
03/10/1965,0.0,9.1,38.5,21.5,03/10/1965,1965-10-03,1965,10
04/10/1965,0.0,8.2,38.5,18.0,04/10/1965,1965-10-04,1965,10
05/10/1965,0.0,7.2,39.5,17.5,05/10/1965,1965-10-05,1965,10
06/10/1965,0.0,7.7,37.5,19.5,06/10/1965,1965-10-06,1965,10
07/10/1965,0.0,6.4,38.5,21.5,07/10/1965,1965-10-07,1965,10
08/10/1965,0.0,7.4,40.5,21.5,08/10/1965,1965-10-08,1965,10
09/10/1965,0.0,6.2,38.0,21.5,09/10/1965,1965-10-09,1965,10
10/10/1965,0.0,6.1,38.0,22.5,10/10/1965,1965-10-10,1965,10
11/10/1965,0.0,6.0,38.5,20.5,11/10/1965,1965-10-11,1965,10
12/10/1965,0.0,6.1,37.5,22.5,12/10/1965,1965-10-12,1965,10
13/10/1965,0.0,6.2,38.0,21.5,13/10/1965,1965-10-13,1965,10
14/10/1965,0.0,7.0,37.5,23.0,14/10/1965,1965-10-14,1965,10
15/10/1965,0.0,6.8,36.5,23.5,15/10/1965,1965-10-15,1965,10
16/10/1965,0.0,4.7,34.5,22.0,16/10/1965,1965-10-16,1965,10
17/10/1965,0.0,5.3,34.0,20.5,17/10/1965,1965-10-17,1965,10
18/10/1965,0.0,6.9,34.5,19.0,18/10/1965,1965-10-18,1965,10
19/10/1965,0.0,4.6,36.0,14.5,19/10/1965,1965-10-19,1965,10
20/10/1965,0.0,6.6,37.5,15.0,20/10/1965,1965-10-20,1965,10
21/10/1965,0.0,6.1,37.5,15.5,21/10/1965,1965-10-21,1965,10
22/10/1965,0.0,7.3,37.5,26.0,22/10/1965,1965-10-22,1965,10
23/10/1965,0.0,9.7,38.5,21.0,23/10/1965,1965-10-23,1965,10
24/10/1965,0.0,10.1,38.5,16.0,24/10/1965,1965-10-24,1965,10
25/10/1965,0.0,8.9,38.5,18.0,25/10/1965,1965-10-25,1965,10
26/10/1965,0.0,9.9,38.5,18.5,26/10/1965,1965-10-26,1965,10
27/10/1965,0.0,8.1,37.5,15.5,27/10/1965,1965-10-27,1965,10
28/10/1965,0.0,8.4,37.5,16.0,28/10/1965,1965-10-28,1965,10
29/10/1965,0.0,9.6,37.0,16.0,29/10/1965,1965-10-29,1965,10
30/10/1965,0.0,9.2,38.5,16.5,30/10/1965,1965-10-30,1965,10
31/10/1965,0.3,6.2,37.5,16.0,31/10/1965,1965-10-31,1965,10
01/11/1965,8.8,6.7,36.5,20.5,01/11/1965,1965-11-01,1965,11
02/11/1965,0.0,6.6,36.0,18.5,02/11/1965,1965-11-02,1965,11
03/11/1965,0.0,6.3,36.0,15.5,03/11/1965,1965-11-03,1965,11
04/11/1965,0.0,7.1,38.0,17.0,04/11/1965,1965-11-04,1965,11
05/11/1965,0.0,6.0,38.5,18.0,05/11/1965,1965-11-05,1965,11
06/11/1965,0.0,5.0,37.5,16.5,06/11/1965,1965-11-06,1965,11
07/11/1965,0.0,5.5,35.5,16.5,07/11/1965,1965-11-07,1965,11
08/11/1965,0.0,6.9,36.5,15.5,08/11/1965,1965-11-08,1965,11
09/11/1965,0.0,5.3,35.0,14.0,09/11/1965,1965-11-09,1965,11
